Pais,Categoria,Subcategoria,Limite,Estado,Titulo,Titulo 1,Titulo 2,Titulo 3,Titulo 4,Titulo 5,Titulo 6,Titulo 7,Titulo 8,Titulo 9,Titulo 10,Titulo 11,Titulo 12,Titulo 13,Titulo 14,Titulo 15,Titulo 16,Titulo 17,Titulo 18,Titulo 19,Titulo 20,Titulo 21,Titulo 22,Titulo 23,Titulo 24,Titulo 25
Alemania,Escultura,Neoclasicismo,25,Completado,,La Libertad guiando al pueblo,El Hombre de Vitruvio,La Victoria de Samotracia,El David de Miguel Ángel,La Venus de Milo,El Apoxiomenos,El Hércules de Lysippos,El Hermes con el niño Dionisio,El Laocoonte,El Gallo de la Cámara de los Césares,La Minerva de Praxiteles,El Fauno de la Villa Albani,El Tiberio de la Villa Adriana,El César Augusto de Prima Porta,El Apolo de Belvedere,El Ganímedes de la Villa Ludovisi,El Antinoüs de la Villa Albani,El Fauno de la Villa Borghese,El César de la Villa dei Papiri,El Hermes de la Villa di Livia,El Sileno de la Villa Giulia,El Niño con el cabrito,El Hércules de la Villa Albani,El Tiberio de la Villa dei Papiri,El Fauno de la Villa dei Quintili
Alemania,Escultura,Romanticismo,25,Completado,,El Caballero de la Muerte,La Victoria de Samothracia (reconstruida en Alemania),El Ángel de la Muerte,La Libertad Guiando al Pueblo (versión alemana en escultura),El Lamento de la Virgen,El Héroe del Pueblo,La Sirena de la Niebla,El Canto del Águila,La Estatua de Friedrich Schiller,El Poeta y el Sueño,El Vidente de los Alpes,La Esperanza en el Abismo,El Solitario del Bosque,La Dama del Lago,El Guardián del Umbral,El Caminante entre las Ruinas,La Sombra del Pasado,El Héroe de la Tierra,La Cumbre del Destino,El Viento del Norte,La Noche del Otoño,El Silencio del Mar,El Sueño del Poeta,La Estatua de Goethe en Weimar,El Ángel del Fuego
Alemania,Escultura,Realismo,25,Completado,,La Loba de Berlin,El Hombre del Río (Der Mann aus dem Fluss),El Soldado de la Guerra (Der Krieger),"El Monumento a los Caídos de la Primera Guerra Mundial (Memorial de los Muertos de la Primera Guerra Mundial, Trier)","El Monumento a los Muertos del Mar (Marinekriegerdenkmal, Kiel)","El Hombre del Pueblo (Der Bürger, Dresden)","El Monumento a los Caídos de la Segunda Guerra Mundial (Gedenkstätte für die Opfer des Zweiten Weltkrieges, Berlin)","El Monumento a la Libertad (Freiheitsdenkmal, Hamburg)","El Monumento a los Víctimas del Holocausto (Holocaust-Mahnmal, Berlin)","El Monumento a los Víctimas del Totalitarismo (Denkmal für die Opfer des Totalitarismus, Berlin)","El Monumento a los Caídos de la Guerra de los Treinta Años (Kriegsdenkmal des Dreißigjährigen Krieges, Nördlingen)","El Monumento a los Soldados de la Revolución (Revolutionssoldat, Leipzig)","El Monumento a los Caídos de la Revolución de 1848 (Denkmal der Opfer der Märzrevolution, Frankfurt am Main)","El Monumento a los Caídos de la Guerra de los Treinta Años (Kriegsdenkmal, Halle an der Saale)","El Monumento a los Víctimas del Totalitarismo (Denkmal für die Opfer des Totalitarismus, Weimar)","El Monumento a los Caídos de la Guerra de los Treinta Años (Kriegsdenkmal, Magdeburg)","El Monumento a los Caídos de la Guerra de los Treinta Años (Kriegsdenkmal, Erfurt)","El Monumento a los Caídos de la Guerra de los Treinta Años (Kriegsdenkmal, Wittenberg)","El Monumento a los Caídos de la Guerra de los Treinta Años (Kriegsdenkmal, Schwerin)","El Monumento a los Caídos de la Guerra de los Treinta Años (Kriegsdenkmal, Potsdam)","El Monumento a los Caídos de la Guerra de los Treinta Años (Kriegsdenkmal, Braunschweig)","El Monumento a los Caídos de la Guerra de los Treinta Años (Kriegsdenkmal, Bremen)","El Monumento a los Caídos de la Guerra de los Treinta Años (Kriegsdenkmal, Darmstadt)","El Monumento a los Caídos de la Guerra de los Treinta Años (Kriegsdenkmal, Regensburg)","El Monumento a los Caídos de la Guerra de los Treinta Años (Kriegsdenkmal, Augsburg)"
Alemania,Escultura,Impresionismo y Post-Impresionismo,25,Completado,,El Hombre que Camina (Der Wanderer) de Ernst Barlach,"La Libertad Llevando al Pueblo (Die Freiheit, die das Volk führt) de Gerhard Marcks",El Monumento a los Muertos de la Primera Guerra Mundial (Gedenkstein für die Gefallenen des Ersten Weltkriegs) de Georg Kolbe,La Fuente de la Vida (Quelle des Lebens) de Wilhelm Lehmbruck,El Niño con el Oso (Das Kind mit dem Bären) de Max Klinger,La Mujer con el Cesto (Die Frau mit dem Korb) de Fritz Cremer,El Hombre con la Maza (Der Mann mit dem Hammer) de Arno Breker,El Monumento a los Caídos de la Revolución de 1918 (Denkmal für die gefallenen Soldaten der Novemberrevolution) de Wilhelm Lehmbruck,"La Mujer que Llama (Die Frau, die ruft) de Gerhard Marcks",El Canto del Mundo (Das Lied der Welt) de Ernst Barlach,La Victoria de la Luz (Der Sieg des Lichts) de Arno Breker,El Canto de la Tierra (Das Lied der Erde) de Georg Kolbe,La Plegaria (Die Gebet) de Wilhelm Lehmbruck,El Hombre que Lucha (Der kämpfende Mensch) de Ernst Barlach,La Madre y el Niño (Mutter und Kind) de Fritz Cremer,El Grito (Der Schrei) de Ernst Barlach,El Pescador (Der Fischer) de Georg Kolbe,La Esperanza (Die Hoffnung) de Gerhard Marcks,El Viento que Sopla (Der Wind weht) de Ernst Barlach,El Hombre que Carga (Der Träger) de Wilhelm Lehmbruck,"El Niño que Sueña (Das Kind, das träumt) de Max Klinger",La Libertad que Camina (Die frei schreitende Freiheit) de Arno Breker,El Hombre de la Cruz (Der Mensch am Kreuz) de Ernst Barlach,La Fuente de la Esperanza (Quelle der Hoffnung) de Georg Kolbe,El Monumento a los Caídos de la Guerra (Denkmal für die Gefallenen des Krieges) de Fritz Cremer
Alemania,Escultura,Modernismo,25,Completado,,La Libertad guiando al pueblo,El pensador,La escultura del hombre en el espacio,El hombre que camina I,La fuente de la libertad,El gran toro,El hombre que mira,La escultura del silencio,El ángel de la muerte,La escultura de la esperanza,El hombre que carga con el mundo,La escultura del tiempo,El hombre que sueña,La escultura del destino,El hombre que espera,La escultura del infinito,El hombre que camina II,La escultura del amor,El hombre que lucha,La escultura del equilibrio,El hombre que mira el horizonte,La escultura del vacío,El hombre que camina hacia el sol,La escultura del sueño,El hombre que se desintegra
Alemania,Escultura,Vanguardias,25,Completado,,El Hombre de Hierro de Ernst Barlach,La Torre de la Libertad de Georg Kolbe,El Cuerpo de la Victoria de Wilhelm Lehmbruck,La Fuente de los Peces de Max Klinger,El Monumento a los Caídos de Fritz Schaper,La Estatua de la Libertad de Wilhelm Kreis,El Hombre de la Llama de Arno Breker,El Pueblo de la Revolución de Rudolf Belling,El Hombre en el Espacio de Hans Poelzig,La Estatua de la Esperanza de Otto Griebel,El Monumento a los Muertos de la Primera Guerra Mundial de Josef Thorak,El Hombre del Futuro de Heinrich Hoerle,La Escultura del Oprimido de Gerhard Marcks,El Hombre del Siglo de Georg Kolbe,El Monumento a la Paz de Wilhelm Lehmbruck,El Hombre del Trabajo de Erich Schmitt,La Estatua de la Libertad de Max Liebermann,El Hombre de la Lucha de Ludwig von Hofmann,El Monumento a la Revolución de Richard Scheibe,El Hombre del Siglo de Wilhelm Worringer,La Estatua del Progreso de Walter Womacka,El Hombre de la Libertad de Paul Landowski,El Monumento al Trabajo de Josef Albers,El Hombre de la Esperanza de Ernst Barlach,La Estatua de la Justicia de Hugo Erfurth
Alemania,Escultura,Arte Moderno y Contemporáneo,25,Completado,,El Hombre de Hierro,La Estatua del Soldado Desconocido,El Monumento a los Judíos Asesinados de Europa,El Monumento a los Víctimas del Holocausto (Berlín),El Grito de la Libertad,El Pabellón de la Libertad,El Monumento a la Memoria del Terrorismo,El Cuerpo de la Libertad,El Árbol de la Vida,El Hombre que Camina hacia el Futuro,El Monumento a la Resistencia,La Estatua del Pensador de Berlín,El Monumento a los Caídos de la Guerra Mundial,El Monumento a la Paz,El Hombre que Lucha por la Justicia,El Monumento a la Memoria del Muro,El Ángel de la Libertad,El Monumento a la Libertad y la Solidaridad,El Hombre que Lleva el Mundo,El Monumento a los Refugiados,El Hombre que Se Eleva,El Monumento a la Esperanza,El Hombre que Camina por el Tiempo,El Monumento a la Memoria de los Niños del Holocausto,El Ángel de la Memoria
Alemania,Arquitectura y Monumentos,Antigüedad (Romana/Griega),25,Completado,,Castrum Aguntum,Circus Maximus de Augusta Treverorum,Templo de Jupiter en Mainz,Agora de Trier,Teatro Romano de Trier,Acueducto de Baden-Baden,Circus de Colonia,Mausoleo de los Hohenstaufen en Worms,Castillo de Königstein,Catedral de Speyer,Catedral de Worms,Catedral de Mainz,Castillo de Heidelberg,Palacio de Sanssouci (con influencias clásicas),Catedral de Bamberg,Monasterio de Fulda,Castillo de Neuschwanstein,Castillo de Hohenschwangau,Museo de la Ciudad de Magdeburgo (estructura antigua),Catedral de Aachen,Palacio Imperial de Aachen,Circus de Trier,Arco de Constantino en Trier,Muro de la ciudad de Regensburg,Puente Romano de Rottweil
Alemania,Arquitectura y Monumentos,Arte Medieval (Románico),25,Completado,,Catedral de Aachen,Catedral de Worms,Catedral de Trier,Catedral de Mainz,Abadía de Fulda,Abadía de Corvey,Catedral de Bremen,Catedral de Magdeburgo,Catedral de Hildesheim,Iglesia de St. Michael en Hildesheim,Iglesia de St. Mary in the White Tower (Bamberg),Abadía de St. Emmeram (Regensburg),Iglesia de St. Martin en Kassel,Iglesia de St. Mary in Hohenburg,Iglesia de St. John in Lüneburg,Iglesia de St. Stephen in Würzburg,Iglesia de St. Mary in Nördlingen,Iglesia de St. George in Aschaffenburg,Iglesia de St. Peter in Regensburg,Iglesia de St. Kilian in Wurzburg,Iglesia de St. Martin in Eichstätt,Iglesia de St. Michael in Munich,Iglesia de St. Martin in Eisleben,Iglesia de St. John in Schwerin,Iglesia de St. Nicholas in Paderborn
Alemania,Arquitectura y Monumentos,Arte Medieval (Gótico),25,Completado,,Catedral de Colonia,Catedral de Freiburg im Breisgau,Catedral de Münster,Catedral de Naumburg,Catedral de Worms,Catedral de Estrasburgo (parte alemana del período gótico),Catedral de Bamberg,Catedral de Trier,Catedral de Magdeburgo,Catedral de Hildesheim,Catedral de Regensburg,Catedral de Augsburgo,Catedral de Núremberg,Catedral de Ratisbona,Catedral de Paderborn,Catedral de Minden,"Catedral de Breslau (Wrocław, actual Polonia, pero históricamente parte del Sacro Imperio Romano Germánico)",Catedral de Schleswig,Catedral de Lübeck,Catedral de Halle (Saale),Catedral de Erfurt,Catedral de Würzburg,Catedral de Speyer,Catedral de Mainz,Catedral de Halberstadt
Alemania,Arquitectura y Monumentos,Renacimiento,25,Completado,,Catedral de Freiburg im Breisgau,Castillo de Neuschwanstein,Catedral de Worms,Catedral de Estrasburgo (parte alemana del período renacentista),Palacio de la Corte de Núremberg,Catedral de Magdeburgo,Castillo de Wartburg,Catedral de Augsburgo,Catedral de Münster,Castillo de Heidelberg,Catedral de Ratisbona (Regensburg),Catedral de Trier,Catedral de Paderborn,Catedral de Minden,Catedral de Schwerin,"Catedral de Breslau (Wrocław, actual Polonia, pero con fuerte influencia alemana en el Renacimiento)",Catedral de Lübeck,Catedral de Münster (reforma arquitectónica renacentista),Palacio de la Corte de Erfurt,Catedral de Hildesheim,Catedral de Bremen,Catedral de Halberstadt,Catedral de Goslar,Catedral de Halle (Saxonia-Anhalt),"Catedral de Königsberg (actual Kaliningrado, Rusia, pero históricamente alemana y con influencia renacentista)"
Alemania,Arquitectura y Monumentos,Manierismo,25,Completado,,Catedral de Würzburg,Palacio de Residenz de Würzburg,Castillo de Heidelberg,Catedral de Augsburgo,Palacio de Nymphenburg (parte manierista en su origen),Catedral de Münster,Catedral de Estrasburgo (influencia manierista en su fachada),Castillo de Schloss Neuschwanstein (estilo manierista tardío con elementos renacentistas),Catedral de Freiburg im Breisgau,Catedral de Trier,Palacio de Schloss Bruchsal,Catedral de Mainz,Castillo de Hohenschwangau,Catedral de Bamberg,Palacio de Schloss Ludwigsburg (fases manieristas tempranas),Catedral de Paderborn,Castillo de Schloss Herrenchiemsee,Catedral de Speyer,Palacio de Schloss Hohenburg,Catedral de Regensburg,Castillo de Schloss Linderhof,Catedral de Erfurt,Palacio de Schloss Gernrode,Catedral de Magdeburgo,Castillo de Schloss Würzburg
Alemania,Arquitectura y Monumentos,Barroco,25,Completado,,Catedral de Freiburg im Breisgau,Castillo de Neuschwanstein,Palacio de Nymphenburg,Catedral de Würzburg,Palacio de Sanssouci,Iglesia de San Pedro y San Pablo en Münster,Catedral de Augsburgo,Iglesia de la Asunción de la Virgen en Ingolstadt,Catedral de Ratisbona (Regensburg),Iglesia de San Juan Bautista en Regensburg,Castillo de Hohenschwangau,Catedral de Mainz,Iglesia de San Miguel en Augsburgo,Palacio de la Corte en Weimar,Iglesia de San Esteban en Nuremberg,Catedral de Münster,Iglesia de San Pedro en Trier,Palacio de la Corte en Potsdam,Iglesia de San Nicolás en Leipzig,Catedral de Magdeburgo,Iglesia de San Martín en Frankfurt am Main,Iglesia de San Juan en Heidelberg,Castillo de Marienberg en Würzburg,Iglesia de San Pedro en Coburgo,Iglesia de San Juan Bautista en Bamberg
Alemania,Arquitectura y Monumentos,Rococó,25,Completado,,Schloss Bruchsal,Schloss Schwetzingen,Schloss Nymphenburg,Schloss Würzburg,Schloss Ludwigsburg,Schloss Herrenchiemsee,Schloss Charlottenburg,Schloss Sanssouci,Schloss Pommersfelden,Schloss Schleißheim,Schloss Schleusingen,Schloss Bensberg,Schloss Gernrode,Schloss Hohenburg,Schloss Göttingen,Schloss Lichtenstein,Schloss Rastatt,Schloss Hohenheim,Schloss Dachau,Schloss Neuburg an der Donau,Schloss Marienburg,Schloss Hohenberg,Schloss Ruppin,Schloss Hohenstein,Schloss Lauenstein
Alemania,Arquitectura y Monumentos,Neoclasicismo,25,Completado,,Templo de la Victoria (Viktoria- und Siegesdenkmal) en Berlín,La Casa del Rey (Königsbau) en Potsdam,El Palacio de Sanssouci en Potsdam,El Monumento a la Libertad en Berlín,El Palacio de la República (Reichstagsgebäude) en Berlín,El Teatro Nacional de Berlín (Berliner Staatsoper),El Museo de Antigüedades de Berlín (Altes Museum),El Palacio de Justicia de Berlín,La Iglesia de San Nicolás en Berlín,El Monumento a Friedrich Schiller en Weimar,El Palacio de Weimar (Weimarer Schloss),La Casa de Goethe en Weimar,El Teatro de Weimar (Weimarer Theater),El Palacio de la Corte de Dresde (Dresden Hofkirche),El Palacio de la Corte de Dresde (Dresdner Residenzschloss),El Monumento a la Libertad en Dresde,La Iglesia de San Juan en Dresde,El Palacio de la Corte de Múnich (Münchner Residenz),El Teatro de la Corte de Múnich (Bayerisches Staatstheater),El Palacio de la Corte de Múnich (Münchner Residenz),El Monumento a la Libertad en Múnich,La Iglesia de San Pedro en Múnich,El Palacio de la Corte de Hamburgo (Hamburger Rathaus),El Monumento a la Libertad en Hamburgo,La Iglesia de San Nicolás en Hamburgo
Alemania,Arquitectura y Monumentos,Romanticismo,25,Completado,,Castillo de Neuschwanstein,Catedral de Colonia (restauración romántica),Castillo de Hohenschwangau,Castillo de Linderhof,Castillo de Marienburg,Castillo de Eger,Castillo de Wartburg,Castillo de Hohensalzburg (influencia romántica en su restauración),Castillo de Altenburg,Castillo de Babelsberg,Castillo de Branitz,Castillo de Pillnitz,Castillo de Sonnenstein,Castillo de Schloss Friedrichshof,Castillo de Schloss Reinhardsbrunn,Castillo de Schloss Schönborn,Castillo de Schloss Tegel,Castillo de Schloss Lichtenstein,Castillo de Schloss Bärenfels,Castillo de Schloss Rastatt,Castillo de Schloss Hohenburg,Castillo de Schloss Gudensberg,Castillo de Schloss Riegenroth,Castillo de Schloss Hohenstein,Castillo de Schloss Münster
Alemania,Arquitectura y Monumentos,Realismo,25,Completado,,Reichstagsgebäude (Edificio del Reichstag) en Berlín,Museo de la Ciudad de Berlín (Berliner Stadtmuseum),Puente de la Constitución (Bundesbrücke) en Berlín,Catedral de Santa María de Königsberg,Palacio de Schönhausen en Berlín,Castillo de Neuschwanstein en Baviera,Catedral de Colonia (Kölner Dom),Museo de la Historia de Alemania en Berlín,Estación Central de Hamburgo (Hamburger Hauptbahnhof),Palacio de la Cultura en Berlín,Museo de Arte Moderno de Düsseldorf (Kunstsammlung Nordrhein-Westfalen),Catedral de Magdeburgo,Catedral de Freiburg im Breisgau,Castillo de Hohenschwangau,Museo del Ferrocarril de Nuremberg,Palacio de la Residencia en Würzburg,Museo de la Historia del Transporte en Leipzig,Catedral de Münster,Castillo de Linderhof,Museo de la Historia de la República Federal de Alemania en Bonn,Estación de Ferrocarril de Frankfurt am Main,Catedral de Trier,Palacio de la Justicia en Karlsruhe,Museo del Ferrocarril de Hannover,Catedral de Wittenberg
Alemania,Arquitectura y Monumentos,Impresionismo y Post-Impresionismo,25,Completado,,Fachada del Museo de Arte Moderno de Berlín (Berliner Philharmonie),Casa de los Artistas en Darmstadt (Mathildenhöhe),Palacio de la Ópera de Berlín (Berliner Staatsoper),Estación Central de Berlín (Berlin Hauptbahnhof),Catedral de San Nicolás de Leipzig,Casa de los Tres Hermanos en Munich (Haus der Drei Brüder),Museo de Historia de la Ciudad de Hamburgo (Hamburger Kunsthalle),Catedral de Colonia (Kölner Dom),Castillo de Neuschwanstein,Museo de Arte Contemporáneo de Kassel (Fridericianum),Museo de Arte Moderno de Düsseldorf (Kunstsammlung Nordrhein-Westfalen),Casa de los Artistas en Weimar (Weimarer Kunstlerkolonie),Estación de Ferrocarril de Frankfurt am Main,Catedral de Münster,Palacio de la Corte de Würzburg,Casa de los Artesanos en Nuremberg (Haus der Künstler),Museo de Arte de Mannheim (Museum für Moderne Kunst),Catedral de Freiburg im Breisgau,Castillo de Hohenschwangau,Museo de Arte de Augsburg (Augsburger Kunstverein),Palacio de la Corte de Stuttgart,Catedral de Ratisbona (Regensburg),Casa de los Artesanos en Heidelberg,Museo de Arte de Dresde (Staatliche Kunstsammlungen Dresden),Catedral de Münster
Alemania,Arquitectura y Monumentos,Modernismo,25,Completado,,Fachenhäuser in der Kölner Altstadt,"Villa Tugendhat en Brno (aunque fuera de Alemania, diseñada por Mies van der Rohe)",Fagus-Werk en Alfeld an der Leine,Bauhaus-Universität Weimar,Hufeisensiedlung en Berlín,Neues Museum en Berlín,Deutscher Werkbund-Ausstellung 1914 en Cologne,Schloss Bensberg (reconstrucción modernista),Haus am Horn en Weimar,Stadthaus en Berlin,Haus der Deutschen Kunst in München,Kunstgewerbemuseum en Düsseldorf,Kaiser Wilhelm Memorial Church en Berlín,Museum für Moderne Kunst en Frankfurt am Main,Haus der Kunst en Múnich,Bauhaus-Archiv en Berlín,Neue Nationalgalerie en Berlín,Kulturforum en Berlín,Stadion des Sports in Leipzig,Kulturhaus in Essen,Stadthalle en Stuttgart,Friedrichshain-Kreuzberg-Museum,Zollverein Coal Mine Industrial Complex en Essen,Bauhaus-Gruppe in Dessau,Haus der Kunst in Núremberg
Alemania,Arquitectura y Monumentos,Vanguardias,25,Completado,,Fachenhäuser der Bauhaus in Dessau,La Casa de la Cultura (Kulturpalast) en Dresden,El Palacio de la República (Palast der Republik) en Berlín,La Torre de la Radio de Berlín (Fernsehturm Berlin),El Edificio de la Ópera de Berlín (Berliner Staatsoper),El Museo de Arte Moderno de Berlín (Museum für Moderne Kunst),La Casa de los Arquitectos (Architektenhaus) en Darmstadt,El Centro de Convenciones de Hannover (Hannover Messe),La Estación Central de Frankfurt (Frankfurter Hauptbahnhof),El Edificio de la Exposición Internacional de 1937 en Berlín,El Palacio de la Exposición (Haus der Kulturen der Welt),El Monumento a las Víctimas del Holocausto en Berlín,El Puente de la Ciudad (Stadtbahnbrücke) en Leipzig,El Edificio de la Compañía de Seguros Allianz en Munich,El Centro de Artes Escénicas de Stuttgart (Staatstheater Stuttgart),La Casa de la Cultura de Halle (Kulturpalast Halle),El Edificio del Parlamento de Brandeburgo (Landtag Brandenburg),El Centro de Exposiciones de Núremberg (Nürnberger Messezentrum),La Estación de Ferrocarril de Karlsruhe (Karlsruher Hauptbahnhof),El Centro de Innovación Tecnológica de Aachen (RWTH Aachen),El Edificio de la Universidad de Colonia (Universität zu Köln),El Centro de Arte Contemporáneo de Düsseldorf (Kunstverein Düsseldorf),El Museo de la Ciudad de Bremen (Bürgermeister-Müller-Haus),El Teatro de la Opera de Essen (Opernhaus Essen),El Edificio de la Sociedad de Artes y Oficios de Mannheim
Alemania,Arquitectura y Monumentos,Arte Moderno y Contemporáneo,25,Completado,,Fachenhäuser der Neuen Vahr (Hannover),Bundeshaus de Bonn,"Museo Guggenheim Bilbao (diseño de Frank Gehry, aunque en España, influyó en Alemania)","El Palacio de la República (Berlín, reconstrucción moderna)",El Edificio de la Casa de la Cultura (Dresden),La Torre de Televisión de Berlín (Berliner Fernsehturm),El Centro de Convenciones de Hannover (Hannover Messe),El Museo de Arte Contemporáneo de Düsseldorf (K20),"El Teatro Nacional de Berlín (Berliner Staatsoper, remodelación moderna)",El Puente de la Ciudad de Hamburgo (Elbphilharmonie),"El Edificio de la Cámara de los Diputados (Reichstagsgebäude, renovación de Norman Foster)","La Estación Central de Frankfurt (Frankfurter Hauptbahnhof, remodelación contemporánea)",El Museo de Arte Moderno de Frankfurt (MMK),El Centro de Arte y Cultura de Kassel (documenta-Halle),El Centro de Innovación y Tecnología de Stuttgart (Stuttgarter Technologiezentrum),El Edificio de la Oficina de Correos de Leipzig (Neue Post),"El Centro de Arte Contemporáneo de Múnich (Haus der Kunst, reforma del siglo XXI)","El Museo de la Historia de Alemania (Deutsches Historisches Museum, Berlín)",El Centro de Artes Escénicas de Colonia (Kölner Philharmonie),"El Edificio de la Universidad de Freiburg (Freiburger Universität, nueva construcción)",El Centro de Innovación de Heidelberg (Heidelberger Innovation Center),"El Parque de las Artes de Essen (Grugapark, remodelación moderna)",El Edificio de la Biblioteca Pública de Dresde (Staats- und Universitätsbibliothek Dresden),El Centro de Cultura y Conocimiento de Bremen (Bremische Landesbibliothek),El Centro de Arte y Arquitectura de Weimar (Weimarer Kulturzentrum)
Bélgica,Pintura,Antigüedad (Romana/Griega),25,Completado,,La batalla de los celtas contra los romanos,El triunfo de Roma en las Galias,La llegada de los romanos a la región belga,El templo de Mars en Nimega,Los druidas en el bosque de Ardenas,La ciudad romana de Augusta Treverorum,El mercado romano en Tongres,La vida cotidiana en la provincia romana de Belgica,El acueducto de Dinant,Los gladiadores del anfiteatro de Tienen,La procesión religiosa en honor a Júpiter,El viaje del emperador Augusto por las Galias,La construcción del camino romano entre Bruselas y Cambrai,El sacrificio de los prisioneros celtas,La escultura funeraria de un soldado romano en Bélgica,La batalla de la colina de Alesia (representación romana),El retrato del general romano en la frontera belga,La agricultura en la Galia romana,La vida en una villa romana en el valle del Sena,El culto a Minerva en la ciudad de Namur,La guerra contra los partos desde el punto de vista romano,La navegación en el río Escalda durante la época romana,"El mercado de esclavos en la ciudad de Lutecia (actual París, pero con influencia belga)",La representación del dios Cérès en la región belga,La fundación de la colonia romana de Bavay
Bélgica,Pintura,Arte Medieval (Románico),25,Completado,,La Virgen de la Candelaria,El Martirio de San Sebastián,La Adoración de los Reyes Magos,El Juicio Final (Cúpula de la Catedral de Lieja),"La Crucifixión en el Pórtico de la Catedral de San Bavo, Ghent",La Virgen de la Misericordia,El Ángel de la Resurrección (Catedral de Tournai),"La Escena del Paraíso (Pintura mural de la Abadía de Saint-Bavo, Ghent)","San Pedro y San Pablo (Retablo de la Iglesia de Saint-Géry, Bruselas)","La Virgen con el Niño y los Santos (Iglesia de Saint-Martin, Liège)",El Martirio de San Andrés,La Transfiguración de Cristo,"El Retablo de San Juan Bautista (Iglesia de Saint-Quentin, Cambrai)",La Virgen de la Piedad (Catedral de Namur),San Juan Evangelista en Patmos,La Crucifixión con la Virgen y San Juan,"La Resurrección de Lázaro (Mural de la Iglesia de Saint-Pierre, Mons)",El Apocalipsis: La Batalla del Arcángel Miguel,"La Virgen de la Corona (Iglesia de Saint-Étienne, Huy)",San Pedro y San Pablo en el Jardín del Edén,El Corazón de Jesús en el Trono de Gloria,"La Virgen de la Virilidad (Iglesia de Saint-Martin, Liège)",San Pedro y San Pablo en la Ciudad Celestial,"La Coronación de la Virgen (Catedral de Saint-Bavon, Ghent)","El Cordero Místico (Parte del Retablo de la Catedral de Saint-Bavo, Ghent)"
Bélgica,Pintura,Arte Medieval (Gótico),25,Completado,,La Virgen del Cordero Místico,El Retablo de la Virgen de las Tres Cruces,La Adoración de los Reyes Magos,El Juicio Final en la Iglesia de Saint-Géry,La Crucifixión de Cristo (Retablo de Saint-Bavon),La Virgen de la Rosa,El Martirio de San Sebastián,La Virgen de la Catedral de Lieja,El Altar de San Juan Bautista,La Virgen de la Catedral de Namur,La Anunciación (Catedral de Tournai),La Crucifixión de la Catedral de Saint-Trond,El Retablo de San Lucas,La Virgen de la Catedral de Bruselas,La Virgen del Rosario,La Adoración de los Pastores,La Virgen de la Catedral de Lille,El Retablo de San Pedro,La Virgen de la Catedral de Ypres,La Crucifixión de la Iglesia de Saint-Sauveur,La Virgen del Pilar,El Retablo de San Nicolás,La Virgen de la Catedral de Ghent,La Virgen del Altar Mayor de Saint-Martin,La Virgen de la Catedral de Mons
