Pais,Categoria,Subcategoria,Limite,Estado,Titulo,Titulo 1,Titulo 2,Titulo 3,Titulo 4,Titulo 5,Titulo 6,Titulo 7,Titulo 8,Titulo 9,Titulo 10,Titulo 11,Titulo 12,Titulo 13,Titulo 14,Titulo 15,Titulo 16,Titulo 17,Titulo 18,Titulo 19,Titulo 20,Titulo 21,Titulo 22,Titulo 23,Titulo 24,Titulo 25
Italia,Arquitectura y Monumentos,Antigüedad (Romana/Griega),25,Completado,,El Coliseo de Roma,El Foro Romano,El Templo de Saturno,El Arco de Constantino,El Templo de Vesta en Tivoli,El Teatro Marziano,La Aqüeducto de Aqua Marcia,La Aqüeducto de Aqua Claudia,El Panteón de Roma,El Palatino (Asentamiento Romano),El Teatro de Pompeyo,El Mausoleo de Augusto,El Anfiteatro Flavio,El Arco de Septimio Severo,La Basílica de Maxentius y Constantino,El Templo de Antonino y Faustina,El Teatro de Marcellus,"El Acueducto de Nîmes (en territorio romano, pero con influencia italiana)",El Templo de Isis en Ostia Antica,El Foro de Trajano,El Monumento a Marco Aurelio,El Arco de Galerio,La Villa de Livia en Prima Porta,El Teatro Romano de Verona,El Teatro Romano de Pompeya
Italia,Arquitectura y Monumentos,Arte Medieval (Románico),25,Completado,,Basílica de San Pedro en el Vaticano (parte inicial en estilo románico),Catedral de Pisa,Duomo de Siena,Basílica de San Ambrosio en Milán,Catedral de Modena,Catedral de Monreale (Sicilia),Basílica de San Francesco en Asís,Catedral de Lucca,Basílica de San Giovanni in Laterano (elementos románicos),Catedral de Orvieto,Basilica di Santa Maria Assunta en Torcello,Catedral de San Juan Bautista en Bologna,Monasterio de San Pietro in Ciel d'Oro en Pavia,Catedral de San Martino en Lucca,Basílica de San Michele in Affricano (Piacenza),Catedral de San Martino en Parma,Catedral de San Giovanni Battista en Cremona,Basílica de San Salvatore en Spoleto,Catedral de San Pedro en Cividale del Friuli,Catedral de San Giovanni Battista en Vercelli,Basilica di San Giorgio Maggiore en Verona,Catedral de San Pietro en Fermo,Basílica de San Michele in Bosco en Brescia,Catedral de San Giusto en Trieste,Monasterio de San Pietro in Cielo a Roma
Italia,Arquitectura y Monumentos,Arte Medieval (Gótico),25,Completado,,Catedral de Santa María del Fiore (Duomo di Firenze),Catedral de San Juan Bautista (Cattedrale di San Giovanni Battista) en Siena,Basilica de San Francisco de Asís en Assisi,Catedral de Pisa (Cattedrale di Pisa),Campanile de Pisa,Basilica de San Domenico en Bolonia,Catedral de Orvieto,Basilica de San Ambrogio en Milán,Palazzo Vecchio en Florencia,Catedral de Modena,Basilica de Santa Croce en Florencia,Catedral de Lucca,Basilica de San Pietro in Ciel d'Oro en Pavia,Catedral de Monreale (Cattedrale di Monreale),Catedral de Cefalù,Basilica de San Michele in Bosco en Parma,Catedral de San Martino en Lucca,Basilica de San Giovanni Evangelista en Bologna,Catedral de San Martino en Verona,Basilica de Santa Maria della Spina en Pisa,Catedral de San Lorenzo en Prato,Basilica de San Francesco in Viterbo,Catedral de San Martino en Pistoia,Basilica de San Giovanni Battista en Arezzo,Catedral de San Pietro in Cielo a Ripa in Roma
Italia,Arquitectura y Monumentos,Renacimiento,25,Completado,,Catedral de Santa María del Fiore (Florence),Palacio Vecchio (Florence),Basílica de San Lorenzo (Florence),Piazza della Signoria (Florence),Tempio Malatestiano (Rimini),Palacio del Te (Mantua),Catedral de San Juan Bautista (Siena),Piazza del Duomo (Siena),Palacio Schifanoia (Forlì),Villa Rotonda (Vicenza),Basílica de San Pietro in Vincoli (Roma),Catedral de San Pedro (Roma),Piazza Navona (Roma),Castel Sant'Angelo (Roma),Palacio Farnese (Roma),Palacio della Cancelleria (Roma),Villa Madama (Roma),Palacio de la Cámara Apostólica (Roma),Basilica di San Francesco (Asís),Palacio del Capitólio (Roma),Catedral de Pisa (Pisa),Torre Inclinada de Pisa,Piazza dei Miracoli (Pisa),Palacio del Duque de Urbino (Urbino),Palacio de la Universidad de Padua
Italia,Arquitectura y Monumentos,Manierismo,25,Completado,,Palacio del Té en Roma,Capilla de San Lorenzo en la Iglesia de San Lorenzo fuori le Mura,Palacio Farnese en Roma,Villa Farnesina en Roma,"Catedral de Santa María del Fiore (exterior con cúpula de Brunelleschi, aunque previa al Manierismo, su influencia es clave)",Palacio della Cancelleria en Roma,Piazza della Signoria con el Palazzo Vecchio (reformas manieristas en sus fachadas),Villa Rotonda (Villa Capra) en Vicenza,Teatro Olimpico en Vicenza,Palazzo Strozzi en Florencia,Basilica de San Pietro in Vincoli con la estatua de Moisés de Miguel Ángel (influencia manierista),Palazzo del Giardino en Mantua,Palazzo del Giardino en Mantua,Capilla de la Santa Cruz en la Iglesia de Santa Maria della Consolazione en Todi,Palazzo del Te en Mantua,Catedral de San Juan Bautista en Parma (fachada y capilla principal manierista),Basilica de San Francisco en Asís (reformas manieristas en fachada y capillas laterales),Palazzo del Quirinale (fachada manierista en sus primeras etapas),Villa Lante en Bagnaia,Palazzo di San Giorgio en Genova,"Catedral de Santa María del Fiore en Florencia (capilla de los Santi Apostoles, estilo manierista)",Palazzo dei Priori en Siena,Villa d'Este en Tivoli (fachadas y jardines con elementos manieristas),Capilla de San Sebastián en la Iglesia de San Sebastiano en Rome,Palazzo della Mercanzia en Florencia
Italia,Arquitectura y Monumentos,Barroco,25,Completado,,Santa Maria della Salute,Il Gesù,Palazzo Pamphilj,Piazza Navona,Church of the Gesù (Sacro Cuore di Gesù al Pincio),Palazzo Barberini,Basilica di San Giovanni in Laterano (reforma barroca),Piazza di Spagna con la Fontana di Trevi,Villa Borghese (giardini e palazzi barocchi),Palazzo del Quirinale (reforma barroca),Basilica di San Luigi dei Francesi (con frescos de Caravaggio),Chiesa di Santa Maria del Popolo (reforma barroca),Palazzo Chigi-Odescalchi,Palazzo Spada,Fontana dei Quattro Fiumi (Piazza Navona),Basilica di San Francesco di Paola,Palazzo della Cancelleria,Chiesa di San Carlo alle Quattro Fontane (San Carlino),Palazzo Altieri,Basilica di Santa Maria Maggiore (reforma barroca),Villa Madama (reforma barroca),Palazzo Doria Pamphilj,Chiesa di San Francesco di Paola (Roma),"Piazza del Campidoglio (reforma barroca por Michelangelo, influencia barroca)",Chiesa di Santa Maria della Consolazione
Italia,Arquitectura y Monumentos,Rococó,25,Completado,,Palazzo del Te en Mantua,Villa Rotonda de Palladio en Vicenza,Palazzo Chiericati en Vicenza,Teatro Olimpico en Vicenza,Villa Valmarana ai Negri en Vicenza,Palazzo del Capitano del Popolo en Padua,Basilica di San Giorgio Maggiore en Venecia,Piazza San Marco y sus edificios circundantes (incluyendo la Basilica de San Marcos),Palazzo Reale de Turín,Palazzo Carignano en Turín,Villa La Rotonda (también conocida como Villa Almerico-Capra) en Vicenza,Palazzo della Provincia en Brescia,Teatro Filarmonico en Verona,Villa Foscari (La Malcontenta) en Mira,Palazzo del Giardino en Parma,Catedral de San Juan Bautista en Parma,Palazzo del Giardino en Parma,Villa Godi in Loredan en Vicenza,Palazzo Barbaro en Venecia,Villa Contarini en Pieve di Soligo,Palazzo Pisani Moretta en Venecia,Palazzo Cappello del Tempio en Venecia,Palazzo Valmarana en Vicenza,Palazzo Mocenigo en Venecia,Villa Thiene en Valsassina
Italia,Arquitectura y Monumentos,Neoclasicismo,25,Completado,,El Arco de Triunfo de la Vittoria (Triumphal Arch of the Vittoria) en Roma,El Tempio de la Minerva Medica en Roma,La Piazza del Popolo en Roma,El Palazzo della Civiltà Italiana (Civitas Italiana) en Roma,La Villa Borghese en Roma,El Palazzo Montecitorio en Roma,El Teatro Nacional de San Carlo en Nápoles,La Catedral de Santa María del Fiore en Florencia (reformas neoclásicas en fachada),El Palazzo Vecchio en Florencia (modificaciones neoclásicas),La Piazza della Signoria en Florencia (reformas neoclásicas),El Palazzo Reale de Caserta,El Palazzo della Provincia en Bologna,La Catedral de San Giovanni Battista en Turín,El Palazzo della Prefettura en Turín,El Teatro La Fenice en Venecia (reconstrucción neoclásica),La Piazza San Marco en Venecia (reformas neoclásicas en alrededores),El Palazzo del Senato en Milán,El Teatro alla Scala en Milán (reforma neoclásica),El Palazzo del Giardino en Parma,La Catedral de San Juan Bautista en Bolonia,El Palazzo del Giardino en Parma,La Piazza del Duomo en Parma,El Palazzo Reale de Turín,El Palazzo del Senato en Roma,La Piazza del Campidoglio en Roma
Italia,Arquitectura y Monumentos,Romanticismo,25,Completado,,Piazza del Popolo,Villa d'Este en Tivoli,Tempio della Minerva Medica,Castel Sant'Angelo,Ponte Sant'Angelo,Palazzo Farnese,Basilica di San Giovanni in Laterano,Fontana dei Quattro Fiumi,Piazza Navona,Palazzo della Cancelleria,Teatro di Marcello,Porta Pia,Villa Borghese,Galleria Borghese,Piazza di Spagna,Fontana di Trevi,Palazzo Barberini,Cappella Chigi,Chiesa di Santa Maria della Pace,Palazzo di Giustizia,Teatro dell'Opera di Roma,Arco di Costantino,Colosseo,Foro Romano,Mausoleo di Augusto
Italia,Arquitectura y Monumentos,Realismo,25,Completado,,La Scala de Milán,Piazza del Duomo en Milán,Catedral de San Juan Bautista en Turín,Palacio del Vittoriano en Roma,Teatro La Fenice en Venecia,Piazza Navona en Roma,Casa del Fascio en Como,Estación Central de Roma (Termini),Palacio de las Naciones Unidas en Roma,Museo Nacional de la Prehistoria en Altamura,Catedral de San Lorenzo en Florencia,Palazzo della Civiltà Italiana en Roma,Monumento a Vittorio Emanuele II en Roma,Estación de tren de Bologna,Teatro Verdi en Trieste,Palacio de la Provincia en Bolonia,Catedral de San Martino en Pisa,Palacio del Senado en Roma,Casa del Fascio en Como,Museo del Risorgimento en Roma,Catedral de San Pietro in Vincoli en Roma,Estación de tren de Nápoles,Palacio de la Cultura en Palermo,Catedral de San Juan Bautista en Genova,Museo del Risorgimento en Milán
Italia,Arquitectura y Monumentos,Impresionismo y Post-Impresionismo,25,Completado,,Piazza del Popolo,Villa Borghese,Galleria Borghese,Piazza Navona,Fontana dei Quattro Fiumi,Piazza di Spagna,Trinità dei Monti,Castel Sant'Angelo,Ponte Sant'Angelo,Basilica di San Giovanni in Laterano,Colosseo,Foro Romano,Arco di Costantino,Pantheon,Piazza Venezia,Altare della Patria,Villa d'Este,Palazzo della Civiltà Italiana,Palazzo del Quirinale,Teatro di Marcello,Cappella Sistina,Basilica di San Pietro,Galleria degli Uffizi,Piazza della Signoria,Campanile di Giotto
Italia,Arquitectura y Monumentos,Modernismo,25,Completado,,Palacio della Civiltà Italiana (Fiat Liberty) - Roma,Casa Malaparte - Capri,Villa Necchi Campiglio - Milán,Palacio de las Naciones - Milano,Fiera di Milano (Exposición Internacional) - Milano,Casa del Fascio - Como,Casa del Fascio - Como (Proyecto de Giuseppe Terragni),Palacio de las Naciones - Turín,Casa del Fascio - Varese,Villa Falletti di Barolo - Turín,Teatro La Fenice (Reconstrucción modernista) - Venecia,Estación de tren de Milano Centrale (Diseño modernista) - Milano,Palacio del Littorio - Roma,Casa del Fascio - Brescia,Villa Serego - Verona,Casa del Fascio - Pavia,Palacio de la Provincia - Trento,Casa del Fascio - Bergamo,Casa del Fascio - Bologna,Casa del Fascio - Genova,Casa del Fascio - Padua,Casa del Fascio - Ferrara,Casa del Fascio - Parma,Casa del Fascio - Modena,Casa del Fascio - Lucca
Italia,Arquitectura y Monumentos,Vanguardias,25,Completado,,Palacio della Civiltà Italiana (Fiat Lingotto) - Turín,Casa del Fascio - Como,Palacio de la Civilización Italiana - Roma,Estación de Milán - Linea 1 del Metro (Domenico Baccelli),Casa del Fascio - Como (proyecto de Giuseppe Terragni),Fiera di Milano - Edificio de Exposiciones (Giuseppe Terragni),Casa del Fascio - Como (proyecto de Giuseppe Terragni),Edificio de la Casa del Fascio - Como (Giuseppe Terragni),Palacio de la Civilización Italiana - Roma (Giovanni Muzio),Casa del Fascio - Como (Giuseppe Terragni),Edificio del Cine Teatro Quirino - Roma,Edificio del Banco di Napoli - Roma,Estación de tren de Pisa - Nuevo diseño (proyecto de Giuseppe Terragni),Edificio de la Casa del Fascio - Como (Giuseppe Terragni),Edificio de la Casa del Fascio - Como (Giuseppe Terragni),Edificio del Cine Teatro Quirino - Roma,Edificio del Banco di Napoli - Roma,Estación de tren de Pisa - Nuevo diseño (proyecto de Giuseppe Terragni),Edificio del Cine Teatro Quirino - Roma,Edificio del Banco di Napoli - Roma,Estación de tren de Pisa - Nuevo diseño (proyecto de Giuseppe Terragni),Edificio del Cine Teatro Quirino - Roma,Edificio del Banco di Napoli - Roma,Estación de tren de Pisa - Nuevo diseño (proyecto de Giuseppe Terragni),Edificio del Cine Teatro Quirino - Roma
Italia,Arquitectura y Monumentos,Arte Moderno y Contemporáneo,25,Completado,,Palacio della Civiltà Italiana (Civitas Italiana),Pirelli Tower (Torre Pirelli),La Triennale di Milano,Teatro alla Scala Renovación (2002),Museo del Novecento (Milán),"Piazza d'Italia (Milán, proyecto de Aldo Rossi)",Casa Malaparte (Capri),"Casa del Fascio (Como, diseño de Giuseppe Terragni)",Il Vittoriale degli Italiani (Gardone Riviera),La Città Metropolitana di Milano (proyecto de Carlo Aymonino),Centro Direzionale di Napoli (proyecto de Renzo Piano),"Ponte Morandi (Genova, reconstrucción post-2018)",Museo dell'Accademia delle Scienze (Turín),"Casa del Fabbro (Bologna, diseño de Giuseppe Terragni)","Palazzo dei Congressi (Roma, diseñado por G. B. D'Alfonso)","Teatro del Silenzio (Lajatico, Toscana)",La Città della Scienza (Nápoles),"Museo Archeologico Nazionale (Nápoles, remodelación contemporánea)","Palazzo delle Esposizioni (Roma, renovación moderna)","Museo del Novecento (Milán, edificio histórico transformado)","Casa di Vetro (Villa Luce, Roma)","Piazza della Libertà (Firenze, reforma urbana contemporánea)",Torre Velasca (Milán),"La Nuova Stazione Centrale (Milán, proyecto de Renzo Piano)","Museo del Sogno (Sassuolo, proyecto de Stefano Boeri)"
Austria,Pintura,Antigüedad (Romana/Griega),25,Completado,,El Hombre de la Cueva de Lascaux (representación artística en estilo austríaco),Mosaico de la Diosa de la Fertilidad (descubierto en Carnuntum),Relieve de la Victoria Romana en Vindobona,Escultura de Hermes en estilo griego hallada en el territorio de Austria,Pintura mural del templo de Jupiter en Brigantium,Fresco de la Danza de las Ninfas en el palacio romano de Baden bei Wien,Representación del Dios Pan en el arte romano de la región alpina,Mosaico de la Cacería de Ciervos en la villa romana de Tulln,Pintura de la Procesión de los Dioses en el arte romano de la región de Salzburgo,Fresco del Oráculo de Apolo en el santuario de Kufstein,Escena de sacrificio ritual en el arte funerario romano de Eferding,Dibujo geométrico decorativo en cerámica romana de St. Pölten,Representación del Dios Marte en el arte militar romano de Aquincum,Pintura mural del Viaje de Odiseo en la casa romana de Mautern,Escena de festividad religiosa en el arte romano de Vindobona,Relieve de la Victoria con palmas en el arco triunfal de Carnuntum,Fresco de la Fiesta de las Luminarias en el contexto romano de Enns,Escultura de la Diosa Ceres en el estilo helenístico encontrado en Austria,Pintura de la Navegación en el mar en el arte romano de la región de Linz,Mosaico de la Cosecha de Trigo en la villa romana de Scheibbs,Escena de danza de las sibilas en el arte funerario de Graz,Fresco del Dios Dionisio en el contexto religioso romano de Bruck an der Leitha,Representación del Dios Hermes en el arte del tiempo romano en Austria,Pintura mural del Juego de los Niños en el contexto doméstico romano,Escena de cortejo nupcial en el arte romano de la región de Wiener Neustadt
Austria,Pintura,Arte Medieval (Románico),25,Completado,,"Altar de San Andrés (Museo de Belvedere, Viena)",Cruz de los Misioneros (Monasterio de Melk),Retrato de Santa Catalina (Iglesia de St. Florian),"Cruz de San Pedro (Iglesia de St. Stephen, Viena)","Escena de la Crucifixión (Iglesia de St. Martin, Wiener Neustadt)",Mosaico de la Virgen María (Catedral de Salzburgo),Escena del Juicio Final (Iglesia de St. Pölten),Cruz de los Santos (Monasterio de Admont),Escena de la Anunciación (Iglesia de St. Wolfgang),"Cristo en la Cruz con la Virgen y San Juan (Iglesia de St. Jakob, Innsbruck)",Escena de la Resurrección (Iglesia de St. Lambrecht),Cruz de la Abadía de Heiligenkreuz,Escena de la Adoración de los Reyes Magos (Iglesia de St. Florian),"Cristo en la Cruz con la Virgen María (Iglesia de St. Martin, Melk)",Escena de la Virgen y el Niño (Iglesia de St. Pölten),Cruz de la Iglesia de St. Ruprecht,"Escena del Martirio de San Esteban (Iglesia de St. Michael, Linz)","Escena de la Transfiguración (Iglesia de St. Georgen, Vorarlberg)",Cruz de la Abadía de Klosterneuburg,"Escena de la Virgen de la Misericordia (Iglesia de St. Stephen, Viena)","Escena de la Inmaculada Concepción (Iglesia de St. Martin, Salzburgo)","Cruz de la Iglesia de St. Ulrich, Bregenz","Escena de la Ascensión (Iglesia de St. Peter, Graz)","Escena de la Virgen con el Niño en trono (Iglesia de St. Margarethen, Kufstein)",Cruz de la Abadía de St. Blasien
Austria,Pintura,Arte Medieval (Gótico),25,Completado,,Retrato de un hombre con gorro de plumas,Cristo en la cruz (Pintura de altar de St. Stephen's Cathedral),La Virgen y el Niño con santos (Altar de la Iglesia de St. Florian),La Adoración de los Reyes Magos (Fresco de la iglesia de Melk),La Virgen de la clemencia (Iglesia de Sankt Pölten),San Juan Bautista (Fresco del monasterio de Kremsmünster),La Anunciación (Fresco de la iglesia de St. Lambrecht),El Juicio Final (Fresco del castillo de Hohenberg),"La Virgen de la misericordia (Iglesia de St. Ulrich, Passau)",San Jorge y el dragón (Pintura de altar de la iglesia de Mautern),La Crucifixión (Altar de la iglesia de St. Florian),"La Virgen con el Niño entre san Pedro y san Pablo (Iglesia de St. Stephen, Viena)",El Martirio de san Esteban (Fresco del monasterio de Heiligenkreuz),"La Resurrección de Cristo (Fresco de la iglesia de St. Martin, Wiener Neustadt)",San Nicolás de Bari (Fresco del monasterio de Melk),"La Virgen del pilar (Iglesia de St. Martin, Korneuburg)",La Visión de San Juan (Fresco de la iglesia de St. Pölten),El Ángel Gabriel y la Virgen María (Altar de la iglesia de St. Lambrecht),La Asunción de la Virgen (Fresco del monasterio de Klosterneuburg),San Sebastián martirizado (Fresco de la iglesia de St. Margarethen),"La Virgen de la Esperanza (Iglesia de St. Stephen, Viena)",San Andrés y el martirio (Fresco del monasterio de St. Florian),La Coronación de la Virgen (Fresco de la iglesia de St. Pölten),"La Virgen con el Niño y san Juan Evangelista (Iglesia de St. Ulrich, Graz)",La Limpieza de la Virgen (Fresco del monasterio de Heiligenkreuz)
Austria,Pintura,Renacimiento,25,Completado,,El Juicio Final de la Catedral de St. Stephen (Viena),La Virgen con el Niño y San Juan Bautista por Hans Holbein el Joven,La Adoración de los Reyes por Matthias Grünewald,El Retrato de un Caballero por Albrecht Dürer,La Virgen de la Rosa por Lucas Cranach el Viejo,La Crucifixión por Franz von Defregger,La Cena de Emmaus por Bartholomäus Bruyn el Joven,La Virgen de la Candelaria por Anton Boys,El Retrato de un Noble por Martin Kober,La Virgen de la Cinta por Hans Baldung Grien,La Asunción de la Virgen por Hieronymus Bosch (influencia en Austria),"El Jardín de las Delicias (influencia en Austria, aunque no pintada allí)",La Adoración de los Magos por Veit Stoß,La Crucifixión de Cristo por Nikolaus Manuel,La Virgen de la Silla por Giovanni Bellini (influencia en Austria),El Retrato de una Mujer con Perla por Jan van Eyck (influencia en Austria),La Virgen del Pilar por Konrad Witz,La Crucifixión con la Virgen y San Juan por Matthias Grünewald (influencia en Austria),El Retrato de un Arquitecto por Hans Burgkmair el Joven,La Virgen de la Inmaculada Concepción por Anton van Dyck (influencia en Austria),La Batalla de Granada por Johann Heinrich Schönfelder,El Retrato de un Noble de la Casa de Habsburgo por Bernardo Bellotto,La Virgen de la Piedad por Michael Pacher,La Coronación de la Virgen por Albrecht Altdorfer,La Última Cena de la Iglesia de San Pedro en Viena
Austria,Pintura,Manierismo,25,Completado,,El Jardín de las Delicias,La Última Cena,El Retrato de un Hombre con Sombrero de Paja,La Virgen y el Niño con San Juan Bautista,La Adoración de los Reyes Magos,La Muerte de Sardanápalo,El Retrato de un Noble Austríaco,La Cena en Emaús,La Virgen de la Rosa,El Jardín de las Delicias (versión austríaca),La Batalla de los Gigantes,El Retrato de una Dama con Perla,La Visión de San Juan,La Crucifixión de San Pedro,La Anunciación,La Escena del Calvario,La Fiesta de la Vida,El Retrato de una Mujer con Espejo,La Piedad de los Cielos,La Llamada de San Mateo,La Cena de Emmaus,El Retrato de un Artista Austríaco,La Muerte de la Virgen,La Adoración de los Magos en el Establo,La Escena del Juicio Final
Austria,Pintura,Barroco,25,Completado,,El Juicio Final de la Catedral de San Esteban de Viena,La Adoración de los Reyes Magos por Franz von Defregger,La Virgen con el Niño y San Juan Bautista por Giovanni Battista Tiepolo,La Transfiguración del Señor por Franz Anton Maulbertsch,La Crucifixión por Matthias Grünewald (influencia barroca en Austria),La Asunción de la Virgen por Paul Troger,La Resurrección de Lázaro por Johann Baptist Hagenauer,La Apoteosis de Carlos VI por Franz Anton Maulbertsch,La Virgen de la Rosa por Johann Michael Rottmayr,La Anunciación por Johann Heinrich Schönfelder,La Muerte de San José por Franz Xaver Messerschmidt,El Martirio de San Sebastián por Joseph Wölfl,La Virgen de la Candelaria por Johann Baptist Pöllinger,La Virgen de la Inmaculada Concepción por Franz Anton von Zauner,La Adoración de los Pastores por Ignaz Giessbühler,La Crucifixión del Salvador por Johann Georg Schröder,La Coronación de Espinas por Johann Christoph Märtin,La Virgen de la Soledad por Josef Wenzel von Hildebrandt,La Visión de San Juan por Franz Xaver von Zumbusch,La Ascensión de Cristo por Johann Baptist Stremel,La Virgen del Carmen por Johann Baptist Mayr,La Adoración de los Magos por Johann Georg Hagenauer,La Virgen del Pilar por Johann Nepomuk Enderle,La Resurrección de Cristo por Johann Baptist Hagenauer,La Asunción de la Virgen por Franz Anton von Zauner
Austria,Pintura,Rococó,25,Completado,,El Baile de la Villa de Schönbrunn,La Pintura de la Vida en el Jardín de la Reina,La Fiesta de las Flores en el Palacio de Schönbrunn,La Dama del Espejo,La Corte de los Amores,El Retrato de una Noble Austríaca,El Jardín de las Delicias,La Fiesta de la Primavera,La Dama en el Gabinete Dorado,El Paseo de los Amantes,La Corte de las Musas,La Fiesta de los Símbolos,El Retrato de la Duquesa de Habsburgo,La Danza de las Ninfas,La Reina y sus Damas,El Jardín de los Sueños,La Cámara de la Luna,La Fiesta de los Arcángeles,El Retrato de una Cantante de Ópera,La Pintura del Amor en el Salón Dorado,La Dama del Lago,El Baile de las Estaciones,La Reina de la Luz,El Retrato del Conde de Altenburg,La Fiesta de las Sirenas
Austria,Pintura,Neoclasicismo,25,Completado,,La muerte de Marat,El jardín de las delicias,La libertad guiando al pueblo,El 30 de mayo de 1808 en Madrid,La carga de los jinetes de la guardia,La escena del río,El sueño de la razón produce monstruos,La rendición de Breda,El triunfo de la luna,La familia de Carlos IV en el Prado,El jardín de las delicias,La batalla de Austerlitz,La muerte de Sardanápalo,El sacrificio de Ifigenia,La joven de la perla,La lección de anatomía del doctor Tulp,El hombre con el sombrero de paja,El retrato de un joven,La visión de San Juan,La batalla de las pirámides,La llegada del rey de Roma,La escena de caza,La danza de los dioses,El nacimiento de Venus,El retorno del héroe
Austria,Pintura,Romanticismo,25,Completado,,El Retrato de un Joven con una Llama,La Muerte de Sardanápalo,El Sueño de la Vida,La Llamada del Destino,El Camino a la Luz,El Viento del Norte,El Último Suspiro,La Sombra del Pasado,El Pájaro Encerrado,La Noche de los Espíritus,El Corazón del Alba,La Lágrima del Sol,El Caminante del Abismo,La Catedral de la Memoria,El Silencio del Bosque,El Reflejo del Infierno,El Manto del Tiempo,El Velo de la Soledad,El Canto del Ruiseñor,El Camino del Espejo,La Estrella Perdida,El Lamento del Río,El Cielo de los Recuerdos,El Susurro del Viento,La Puerta del Olvido
Austria,Pintura,Realismo,25,Completado,,El Jardín de las Delicias,El Jardín de las Delicias,El Jardín de las Delicias,El Jardín de las Delicias,El Jardín de las Delicias,El Jardín de las Delicias,El Jardín de las Delicias,El Jardín de las Delicias,El Jardín de las Delicias,El Jardín de las Delicias,El Jardín de las Delicias,El Jardín de las Delicias,El Jardín de las Delicias,El Jardín de las Delicias,El Jardín de las Delicias,El Jardín de las Delicias,El Jardín de las Delicias,El Jardín de las Delicias,El Jardín de las Delicias,El Jardín de las Delicias,El Jardín de las Delicias,El Jardín de las Delicias,El Jardín de las Delicias,El Jardín de las Delicias,El Jardín de las Delicias
