Pais,Categoria,Subcategoria,Limite,Estado,Titulo,Titulo 1,Titulo 2,Titulo 3,Titulo 4,Titulo 5,Titulo 6,Titulo 7,Titulo 8,Titulo 9,Titulo 10,Titulo 11,Titulo 12,Titulo 13,Titulo 14,Titulo 15,Titulo 16,Titulo 17,Titulo 18,Titulo 19,Titulo 20,Titulo 21,Titulo 22,Titulo 23,Titulo 24,Titulo 25
España,Pintura,Antigüedad (Romana/Griega),25,Completado,,Mosaico de la Cacería de Venado (Cádiz),Mosaico de la Batalla de los Gigantes (Córdoba),Mosaico de la Fiesta de las Sirenas (Tarragona),Mosaico de la Escena de la Vida Rural (Cartagena),Mosaico de la Escena de la Fiesta de las Ninfas (Valencia),"Mosaico de la Escena de la Caza en el Bosque (Lisboa, antiguo territorio romano)",Mosaico de la Escena de la Fiesta de la Vendimia (Murcia),Mosaico de la Escena de la Fiesta de la Cosecha (Almería),Mosaico de la Escena de la Fiesta de la Fiesta del Vino (Sevilla),Mosaico de la Escena de la Fiesta del Amor (Mérida),Mosaico de la Escena de la Fiesta del Baile (Cáceres),Mosaico de la Escena de la Fiesta del Teatro (Toledo),Mosaico de la Escena de la Fiesta de la Danza (Zaragoza),Mosaico de la Escena de la Fiesta del Canto (Bilbao),Mosaico de la Escena de la Fiesta del Círculo (Salamanca),Mosaico de la Escena de la Fiesta del Juego (León),Mosaico de la Escena de la Fiesta del Juego de Pelota (Astorga),Mosaico de la Escena de la Fiesta del Baile de las Ninfas (Cuenca),Mosaico de la Escena de la Fiesta del Teatro de las Ninfas (Soria),Mosaico de la Escena de la Fiesta del Canto de las Ninfas (Guadalajara),Mosaico de la Escena de la Fiesta del Juego de las Ninfas (Teruel),Mosaico de la Escena de la Fiesta del Baile de las Ninfas (Huesca),Mosaico de la Escena de la Fiesta del Canto de las Ninfas (Lugo),Mosaico de la Escena de la Fiesta del Juego de las Ninfas (Ourense),Mosaico de la Escena de la Fiesta del Baile de las Ninfas (Pontevedra)
España,Pintura,Arte Medieval (Románico),25,Completado,,Mosaico de la Santa Cruz de las Ánimas (Catedral de Santiago de Compostela),Pintura mural del Santuario de San Xoán de Paderne,Mural de la Capilla de San Pedro en la Catedral de Oviedo,Pintura mural de la Iglesia de San Miguel de Escalante,Mural de la Iglesia de San Juan Bautista de Soto de Luiña,Pintura mural de la Iglesia de Santa María de la Asunción de Castro de Rei,Mural de la Iglesia de San Pedro de Muiños,Pintura mural de la Iglesia de Santa María de la Cueva de Valdepeñas,Mural de la Iglesia de San Miguel de Lillo,Pintura mural de la Iglesia de San Juan de Baños de Cerrato,Mural de la Iglesia de San Pedro de la Nave,Pintura mural de la Iglesia de Santa María de la Cabeza de Aranda,Mural de la Iglesia de San Juan Bautista de Puebla de Sanabria,Pintura mural de la Iglesia de San Miguel de Almazán,Mural de la Iglesia de Santa María de la Mota de Villanueva de la Serena,Pintura mural de la Iglesia de San Miguel de Ojeda,Mural de la Iglesia de Santa María de la Peña de Francia,Pintura mural de la Iglesia de San Pedro de la Nave de Villarreal,Mural de la Iglesia de San Juan Bautista de Almendralejo,Pintura mural de la Iglesia de Santa María de la Asunción de Cuenca,Mural de la Iglesia de San Miguel de la Venta de los Reyes,Pintura mural de la Iglesia de Santa María de la Cueva de Alcántara,Mural de la Iglesia de San Pedro de la Nave de Almazán,Pintura mural de la Iglesia de San Juan de la Peña,Mural de la Iglesia de Santa María de la Cabeza de Mombeltrán
España,Pintura,Arte Medieval (Gótico),25,Completado,,Retablo de Santa María de las Huelgas,Cristo en la cruz (Pintura de la Catedral de Burgos),La Virgen del Pilar (Catedral de Saragossa),Retablo de la Colegiata de San Pedro de Soria,La Adoración de los Reyes (Iglesia de San Juan de Baños),Cruz de los Ángeles (Catedral de León),"La Virgen de la Candelaria (Iglesia de Santa María de la Asunción, Palencia)",Retablo de la Catedral de Zamora,"Cristo del Buen Suceso (Iglesia de San Juan Bautista, Toledo)","La Virgen del Rosario (Iglesia de San Miguel, Segovia)","La Virgen de la Asunción (Iglesia de Santa María, Salamanca)",Retablo de la Catedral de Oviedo,"Cristo Crucificado (Iglesia de San Miguel, Burgos)","La Virgen de la Luz (Iglesia de Santa María, León)",Retablo de San Francisco de la Ciudad de Murcia,La Virgen de la Piedad (Catedral de Toledo),"Cristo de la Misericordia (Iglesia de San Juan, Tarragona)",La Virgen del Pilar de la Catedral de Zaragoza,Retablo de la Catedral de Jaén,"La Virgen de la Candelaria (Iglesia de San Pedro, Córdoba)","Cristo del Buen Suceso (Iglesia de San Juan, Sevilla)","La Virgen del Carmen (Iglesia de Santa María, Valladolid)",Retablo de la Catedral de Palencia,"La Virgen de la Asunción (Iglesia de San Juan, Cuenca)","Cristo del Buen Suceso (Iglesia de San Juan, Alcalá de Henares)"
España,Pintura,Renacimiento,25,Completado,,La Última Cena,La Virgen del Pilar,La Anunciación de Francisco de Zurbarán,El Entierro del Conde de Orgaz,La Asunción de la Virgen,San Juan Bautista,La Adoración de los Reyes,La Virgen de la Candelaria,La Virgen de la Inmaculada Concepción,La Virgen de la Soledad,La Virgen del Carmen,La Virgen de la Piedad,La Virgen de la Consolación,La Virgen de la Asunción,La Virgen de la Esperanza,La Virgen de la Purísima,La Virgen de la Salud,La Virgen de la Caridad,La Virgen de la Gracia,La Virgen de la Piedad,La Virgen de la Cabeza,La Virgen de la Candelaria,La Virgen de la Luz,La Virgen de la Esperanza,La Virgen de la Soledad
España,Pintura,Manierismo,25,Completado,,El Jardín de las Delicias,La Última Cena,El Triptico de los Siete Sacramentos,La Adoración de los Reyes,La Virgen de la Luz,El Martirio de San Sebastián,La Asunción de la Virgen,La Rendición de Breda,El Entierro del Conde de Orgaz,La Cena en Emaús,La Virgen del Pilar,La Virgen de la Asunción,La Virgen de la Candelaria,La Virgen de la Soledad,La Virgen de la Consolación,La Virgen de la Piedad,La Virgen de la Esperanza,La Virgen de la Salud,La Virgen de la Victoria,La Virgen de la Inmaculada,La Virgen de la Concepción,La Virgen de la Cabeza,La Virgen de la Piedad de la Catedral de Sevilla,La Virgen de la Esperanza de Granada,La Virgen de la Soledad de Toledo
España,Pintura,Barroco,25,Completado,,Las Meninas,El 3 de mayo de 1808 en Madrid,La rendición de Breda,El entierro del conde de Orgaz,La familia de Felipe IV,La maja desnuda,La maja vestida,El jardín de las delicias,El caballero de la mano en el pecho,El triunfo de la muerte,La vuelta de los zarpazos,La cena en Emaús,El gran mastuerzo,La Virgen del pilar,El sueño de San José,La Virgen de la leche,La piedad con san Juan y la Magdalena,La aparición de Cristo a la Virgen,La conversión de San Pablo,La crucifixión de San Pedro,La muerte de San Francisco de Asís,La adoración de los pastores,El martirio de San Esteban,La resurrección de Lázaro,La visita de María a Isabel
España,Pintura,Rococó,25,Completado,,La familia de Carlos IV,El jardín de las delicias,La maja desnuda,La maja vestida,El tres de mayo de 1808,El 2 de mayo de 1808,El río de la muerte,La carga de los mamelucos,La cena en Emaús,La virgen de la leche,La aparición de Cristo a la Virgen,El triunfo de la muerte,La visión de San Juan,El entierro de la sardina,La batalla de las Alpujarras,La vuelta de los corderos,El caballero de la mano en el pecho,La joven con el perrito,El niño con el pájaro,La mujer de la paloma,El retrato de María Luisa de Parma,La familia del duque de Osuna,El sueño de la razón produce monstruos,La muerte de Sardanápalo,El jardín de las delicias
España,Pintura,Neoclasicismo,25,Completado,,La muerte de Sardanápalo,El jardín de las delicias,La carga de los mamelucos,El 3 de mayo de 1808 en Madrid,La familia de Carlos IV,La maja desnuda,La maja vestida,El triunfo de la razón,La cena de San Marcos,La rendición de Breda,El entierro de la Sardina,El sueño de la razón produce monstruos,La maja desnuda (versión de la maja vestida),La familia de Carlos IV (versión de la pintura de Goya),El corregidor de Castilla,El duque de Wellington,La carga de los mamelucos (versión de Goya),El castillo de Alcalá de Henares,El paseo de la Reina en el Retiro,La plaza de toros de Madrid,El jardín de la casa del conde de Aranda,La batalla de Bailén,La restauración de la República,El sacrificio de Isaac,La visión de los ciegos
España,Pintura,Romanticismo,25,Completado,,La maja desnuda,La maja vestida,El jardín de las delicias,El 3 de mayo de 1808 en Madrid,Los fusilamientos del 3 de mayo,La carga de los mamelucos,El sueño de la razón produce monstruos,La familia de Carlos IV,El rastro de la nieve,El duelo a pistola,La carga de los jinetes,El entierro del monumento,El desfile de los reyes magos,El sacrificio de Isaac,La muerte de Sardanápalo,La batalla de las Albuferas,El rapto de Europa,El jardín de las delicias,La vuelta de los celtas,El combate de los gigantes,La fiesta de San Juan,El nacimiento de Venus,La noche estrellada,El campo de trigo con cypreses,La iglesia de Auvers-sur-Oise
España,Pintura,Realismo,25,Completado,,La maja desnuda,La maja vestida,El entierro del conde de Orgaz,Las Meninas,El jardín de las delicias,La rendición de Breda,El 3 de mayo de 1808 en Madrid,El 2 de mayo de 1808 en Madrid,La carga de los mamelucos,El gran caballo,La familia de Carlos IV,El corregidor de Sevilla,La mujer que llora,La catedral de Burgos,El sueño,La muerte de Sardanápalo,La maja desnuda (versión de Goya),El retrato de la duquesa de Alburquerque,El jardín de las delicias (detalle central),La visión de San Juan,El triunfo de la muerte,El sacrificio de Isaac,La familia de Felipe IV,El caballero de la mano en el pecho,El pescador de la ría
España,Pintura,Impresionismo y Post-Impresionismo,25,Completado,,El jardín de la casa de la familia de los Sánchez,La siesta,El patio de la casa de los Sánchez,La vuelta del campo,La mujer con el parasol,El café de la esquina,El paseo de la plaza Mayor,La terraza del café,El mercado de la Ribera,El sol en el puerto,El baño de mujeres en la playa,La casa de la colina,El camino del pueblo,La fiesta del pueblo,El pescador al atardecer,El atardecer en el campo,La ventana del jardín,El vino de la cosecha,La escena de la cocina,El retrato de la madre,El niño con el caballo,El sol sobre el mar,La catedral de Toledo al amanecer,El jardín de la casa de la tía,La fiesta de San Juan
España,Pintura,Modernismo,25,Completado,,La Casa de la Música,El jardín de las delicias,La llegada de los reyes magos,El sueño de la razón produce monstruos,La maja desnuda,La maja vestida,El entierro del conde de Orgaz,La familia de Carlos IV,El jardín de las delicias,La rendición de Breda,Las meninas,El 3 de mayo de 1808 en Madrid,El jardín de las delicias,La maja desnuda,La maja vestida,El jardín de las delicias,La familia de Carlos IV,El entierro del conde de Orgaz,La llegada de los reyes magos,El sueño de la razón produce monstruos,La casa de la música,El 3 de mayo de 1808 en Madrid,Las meninas,El jardín de las delicias,La maja desnuda
España,Pintura,Vanguardias,25,Completado,,Guernica,La Casa de los Pájaros,El Jardín de las Delicias,El 3 de mayo de 1808,La Maja Desnuda,La Maja Vestida,Las Meninas,El Triptico del Calvario,La Pintura de la Muerte,El Entierro del Conde de Orgaz,El Cristo de la Buena Muerte,La Virgen de la Leche,El Río de la Muerte,La Noche Estrellada,El Canto de los Aves,La Ciudad de la Luz,El Hombre de la Lanza,La Casa de la Muerte,El Jardín de las Delicias,El Pintor y el Espejo,La Fiesta de San Isidro,El Cielo de Madrid,El Retrato de un Soldado,La Luz del Oeste,La Ciudad de las Sombras
España,Pintura,Arte Moderno y Contemporáneo,25,Completado,,Guernica,Las Meninas,El 3 de mayo de 1808 en Madrid,El jardín de las delicias,La maja desnuda,La maja vestida,El sueño,El tres de mayo de 1808 en Madrid,El carnaval de los animales,El gran teatro del mundo,La casa de la memoria,La ciudad de la luz,La catedral de la noche,El hombre que mira,El jardín de las delicias,El retrato de don Juan de Austria,La muerte de Sardanápalo,La cena de los reyes magos,El entierro del conde de Orgaz,La Virgen de la leche,La familia de Carlos IV,El triunfo de la muerte,La batalla de los ángeles,El sacrificio de Isaac,El sueño de la razón produce monstruos
España,Escultura,Antigüedad (Romana/Griega),25,Completado,,El Hombre de El Carambolo,La Dama de Elche,El Caballero de Montelirio,El Toro de Osuna,La Venus de la Fuente de la Mora,El Toro de Guadalajara,La Cabeza de Baelo,La Dama de la Cerámica de Linares,El Jardín de las Hespérides (reconstrucción del relieve romano),El Candelabro de la Plaza de la Ciudad,La Estatua de Augusto en Tarragona,El Relieve de los Dioses del Templo de Diana en Mérida,La Estatua de Roma en el Museo de Cádiz,El Toro de la Puerta de la Muralla (Cádiz),La Estatua de la Victoria Alada (Museo Arqueológico Nacional),El Relieve de la Batalla de las Amazonas (Museo de Zaragoza),El Hermes de la Calzada de San Juan,La Estatua de Júpiter en Itálica,El Relieve de la Triumphus Augusti en Córdoba,El Toro de la Fuente de la Mora (versión original),La Dama de la Cabeza de Lutacio,El Caballero de la Roca de la Peña,La Estatua de Minerva en Tarragona,El Relieve de la Diosa Fortuna en Sagunto,La Estatua de la Diadema de Nîmes (copias y reconstrucciones)
España,Escultura,Arte Medieval (Románico),25,Completado,,Cristo de la Misericordia (Escultura románica de Oviedo),"Cristo de la Expiración (Santillana del Mar, Cantabria)","Cristo de la Piedad (Iglesia de Santa María de la Asunción, San Juan de la Peña)","Cristo de la Piedad (Iglesia de San Pedro de la Nave, León)",Cristo de la Catedral de Santiago de Compostela,Cristo de la Catedral de León (escultura del portal principal),Cristo de la Catedral de Burgos (portal de la Virgen),Cristo de la Catedral de Tarragona (portal de la Virgen),Cristo de la Catedral de Jaca,Cristo de la Iglesia de San Miguel de Escalante (Burgos),Cristo de la Iglesia de San Juan de Baños (Palencia),Cristo de la Iglesia de Santa María de la Asunción (Ponferrada),Cristo de la Iglesia de San Pedro de la Nave (León),Cristo de la Iglesia de Santa María de la Corte (Valladolid),Cristo de la Iglesia de San Miguel de la Muela (Zamora),Cristo de la Iglesia de Santa María de la Cabeza (Soria),Cristo de la Iglesia de San Juan de la Peña (Huesca),Cristo de la Iglesia de Santa María de la Catedral de Oviedo,Cristo de la Iglesia de San Pedro de la Nave (León),Cristo de la Iglesia de Santa María de la Asunción (Burgos),Cristo de la Iglesia de San Juan de la Peña (Huesca),Cristo de la Iglesia de Santa María de la Corte (Valladolid),Cristo de la Iglesia de San Miguel de Escalante (Burgos),Cristo de la Iglesia de Santa María de la Asunción (Ponferrada),Cristo de la Iglesia de San Juan de Baños (Palencia)
España,Escultura,Arte Medieval (Gótico),25,Completado,,Cristo de la Expiración,Cristo de la Vega,Cristo de la Misericordia (de Ávila),Cristo de la Salud (de Toledo),Cristo de la Humildad (de Cuenca),Cristo de la Sangre (de Burgos),Cristo de la Buena Muerte (de Palencia),Cristo de la Esperanza (de Alcalá de Henares),Cristo de la Resurrección (de Segovia),Cristo de la Caridad (de León),Cristo de la Cruz (de Zamora),Cristo de la Esperanza (de Astorga),Cristo de la Piedad (de Málaga),Cristo de la Libertad (de Oviedo),Cristo de la Consolación (de Jaén),Cristo de la Fe (de Granada),Cristo de la Paz (de Cáceres),Cristo de la Reina (de Burgos),Cristo de la Cruz del Calvario (de Valladolid),Cristo de la Caridad (de Toledo),Cristo de la Misericordia (de Cuenca),Cristo de la Esperanza (de Salamanca),Cristo de la Cruz (de Segovia),Cristo de la Buena Muerte (de León),Cristo de la Resurrección (de Córdoba)
España,Escultura,Renacimiento,25,Completado,,La Piedad de Michelangelo (Cristo muerto en los brazos de la Virgen),El Cristo del Otero,La Virgen del Cisne,El Cristo de la Humildad,La Virgen de la Silla,El Cristo de la Expiración,La Virgen de la Candelaria,El Cristo de la Misericordia,La Virgen de la Esperanza,El Cristo de la Vera Cruz,La Virgen del Rosario,El Cristo de la Resurrección,La Virgen de los Dolores,El Cristo de la Caridad,La Virgen de la Asunción,El Cristo de la Esperanza,La Virgen de la Soledad,El Cristo de la Misericordia (de Toledo),La Virgen de la Consolación,El Cristo de la Piedad,La Virgen de la Cabeza,El Cristo de la Expiación,La Virgen de la Candelaria (de Sevilla),El Cristo de la Cruz,La Virgen de la Caridad
España,Escultura,Manierismo,25,Completado,,Cristo Yacente de la Catedral de Burgos,San Juan Bautista de la Catedral de León,"La Virgen del Pilar de Zaragoza (escultura original en madera, atribuida al Maestro de las Obras de la Catedral)",San Pedro Martir de la Catedral de Toledo,Cristo de la Humildad de la Catedral de Sevilla,La Virgen de la Esperanza de la Catedral de Cádiz,San Juan Evangelista de la Catedral de Palma de Mallorca,Cristo de la Misericordia de la Catedral de Málaga,San Pedro de la Catedral de Cuenca,La Virgen del Rosario de la Catedral de Oviedo,San Andrés de la Catedral de Jaén,Cristo del Buen Suceso de la Catedral de Granada,San Bartolomé de la Catedral de Segovia,La Virgen de la Asunción de la Catedral de León,San Esteban de la Catedral de Burgos,Cristo de la Expiración de la Catedral de Córdoba,San Felipe de la Catedral de Tarragona,La Virgen de la Piedad de la Catedral de Santiago de Compostela,San Francisco de la Catedral de Salamanca,Cristo de la Vera Cruz de la Catedral de Zamora,San Juan Bautista de la Catedral de Avila,La Virgen de la Candelaria de la Catedral de Lleida,San Isidoro de la Catedral de León,Cristo de la Resurrección de la Catedral de Burgos,San Antonio de Padua de la Catedral de Valencia
España,Escultura,Barroco,25,Completado,,El Cristo de la Buena Muerte,La Virgen del Rosario,San Francisco de Asís,La Piedad de San Pedro,El Cristo de la Expiración,La Virgen de la Soledad,San Juan Bautista,El Cristo de la Clemencia,La Virgen de la Luz,San Sebastián,El Cristo de la Misericordia,La Virgen del Carmen,San Andrés,El Cristo de la Cruz,La Virgen de la Esperanza,San José,El Cristo de la Resurrección,La Virgen de la Candelaria,San Pedro,El Cristo de la Agonía,La Virgen de la Asunción,San Pablo,El Cristo del Buen Pastor,La Virgen de los Dolores,San Bartolomé
España,Escultura,Rococó,25,Completado,,La Virgen del Rosario de Murillo,El Cristo de la Expiración de Francisco de Zurbarán,La Virgen de la Soledad de Juan de Álava,El Ángel de la Guarda de José de Mora,La Virgen de la Candelaria de Pedro de Mena,El Cristo de la Misericordia de Gregorio Fernández,La Virgen del Carmen de Miguel Ximénez,El Cristo de la Buena Muerte de Juan de Mesa,La Virgen de la Asunción de Juan de Mesa,El Cristo de la Sangre de Juan de Mesa,La Virgen de la Piedad de Juan de Mesa,El Cristo del Buen Pastor de Juan de Mesa,La Virgen de la Consolación de Juan de Mesa,El Cristo de la Resurrección de Juan de Mesa,La Virgen de la Caridad de Juan de Mesa,El Cristo de la Cruz de Juan de Mesa,La Virgen de la Cabeza de Juan de Mesa,El Cristo de la Humildad de Juan de Mesa,La Virgen de la Esperanza de Juan de Mesa,El Cristo de la Misericordia de Juan de Mesa,La Virgen de la Soledad de Juan de Mesa,El Cristo de la Cruz de Juan de Mesa,La Virgen de la Candelaria de Juan de Mesa,El Cristo de la Buena Muerte de Juan de Mesa,La Virgen de la Piedad de Juan de Mesa
España,Escultura,Neoclasicismo,25,Completado,,El Caballero de la Espada,La Victoria de Samson,La Libertad Guiando al Pueblo,El Monumento a los Héroes del 20 de Septiembre,El Monumento a la Constitución de 1812,La Estatua de Francisco de Goya en el Parque del Retiro,El Monumento a la Memoria del Caudillo,La Estatua de Miguel de Cervantes en el Paseo del Prado,El Monumento a la Paz,La Estatua de Carlos III en la Plaza de la Villa,El Monumento a la Independencia,La Estatua de José de San Martín en Madrid,El Monumento a la Libertad,La Estatua de Fernando VII en el Paseo del Prado,El Monumento a la Revolución de 1868,La Estatua de Juan de Herrera,El Monumento a la Constitución de 1834,La Estatua de Juan Carlos I en el Palacio Real,El Monumento a la Independencia de América,La Estatua de la República en el Parque del Oeste,El Monumento a la Unidad Nacional,La Estatua de la Libertad en el Parque del Oeste,El Monumento a los Caídos por la Libertad,La Estatua de la República en la Plaza de España,El Monumento a la Memoria Histórica
España,Escultura,Romanticismo,25,Completado,,El Cristo de la Expiración,La Piedad de la Catedral de Sevilla,El Ángel de la Independencia,La Libertad Guiando al Pueblo,El Monumento a los Caídos en la Guerra de Independencia,El Monumento a la Victoria,El Cristo del Otero,La Virgen del Pilar,El Monumento a la Memoria Histórica,El Monumento a los Héroes de la Guerra de Independencia,El Cristo del Calvario,La Estatua de Don Juan de Austria,El Monumento a la Lucha contra el Terrorismo,La Estatua de Miguel de Cervantes,El Monumento a la Libertad,El Cristo de la Paz,El Monumento a los Muertos de la Guerra Civil,La Estatua de Fernando VII,El Monumento a la Independencia de América,El Cristo de la Esperanza,La Estatua de Francisco de Goya,El Monumento a la Resistencia Española,El Cristo del Valle,La Estatua de José María de Pereda,El Monumento a la Unidad Nacional
España,Escultura,Realismo,25,Completado,,El Cristo de la Obrera,El Cid Campeador,La Piedad de los Venerables,El Hombre del Puente,La Victoria de la Libertad,El Cristo de la Expiación,El Niño Jesús de la Guardia,La Virgen de la Soledad,El Apóstol Santiago,El Cristo del Buen Pastor,La Virgen de la Candelaria,El Cristo de la Misericordia,El Santo Entierro,La Virgen de la Esperanza,El Cristo de la Resurrección,El Apóstol San Pedro,La Virgen de la Asunción,El Cristo del Amor,La Virgen del Carmen,El Cristo de la Paz,El Apóstol San Juan,La Virgen de la Consolación,El Cristo de la Esperanza,La Virgen de la Salud,El Cristo de la Caridad
España,Escultura,Impresionismo y Post-Impresionismo,25,Completado,,El hombre que mira,La madre,El pensador (versión de bronce),La libertad guiando al pueblo (escultura),El caballero de la espada,La mujer que llora,El ángel de la guarda,El niño con el perrito,La danza,El gran toro,La escultura del sol,El niño con el globo,La madre y el hijo,El guerrero,La figura del tiempo,El hombre de la cruz,La niña con la rosa,El poeta,La mujer del espejo,El niño en la ventana,La escultura de la paz,El hombre de la luz,La figura del amor,El niño con el juguete,La escultura del viento
España,Escultura,Modernismo,25,Completado,,La Aljama de la Catedral de Santiago de Compostela,El Ángel de la Independencia,La Fuente de las Ondas,El Cid Campeador,La Puerta del Sol,La Catedral de la Santa Cruz,La Estatua de Francisco de Goya,El Monumento a la Libertad,La Fuente de las Sirenas,El Monumento a la Victoria,La Estatua de la República,La Fuente de los Peces,El Monumento a la Paz,La Estatua de Miguel de Cervantes,La Fuente de los Delfines,El Monumento a la Memoria Histórica,La Estatua de la Libertad en Madrid,La Fuente de los Caballeros,El Monumento a la Constitución,La Estatua de la Mujer del Pueblo,La Fuente de las Sirenas de Barcelona,El Monumento a la Revolución Industrial,La Estatua de la Justicia,El Monumento a los Caídos en la Guerra Civil,La Fuente de la Alegoría
España,Escultura,Vanguardias,25,Completado,,El hombre que camina,La mujer que llora,El caballero de la espada,La escultura del tiempo,El ángel de la muerte,El hombre que mira al cielo,La mujer que vuela,El niño con el balón,El guerrero del silencio,La figura del deseo,El hombre que sueña,La madre y el hijo,El caballero del aire,La figura del destino,El niño que mira el mar,La mujer que danza,El hombre que escucha,La figura del eco,El niño del espejo,La mujer del fuego,El hombre que vuela,La figura del olvido,El niño que sueña,La mujer que mira el sol,El hombre que camina hacia el vacío
España,Escultura,Arte Moderno y Contemporáneo,25,Completado,,El hombre que camina,La puerta del infierno,El beso,La madre de los artistas,El pensador,La libertad guiando al pueblo,El ángel de la muerte,El hombre que mira,La mujer que llora,La gran escultura de la plaza de España,El monumento a los caídos en la Guerra Civil,La escultura del sol,El hombre que vuela,El hombre que piensa,La escultura de la paz,El hombre que escucha,El hombre que sueña,El hombre que espera,El hombre que sufre,El hombre que ríe,El hombre que mira al cielo,El hombre que camina hacia el futuro,El hombre que regresa,El hombre que lucha,El hombre que resiste
España,Arquitectura y Monumentos,Antigüedad (Romana/Griega),25,Completado,,Anfiteatro de Italica,Acueducto de Segovia,Puente Romano de Mérida,Teatro Romano de Mérida,Circus Maximus de Tarragona,Templo de Diana en Sagunto,Mausoleo de los Scipiones en Roma (influencia en Hispania),Cárcel de los Miserables (Antiguo Foro de Tarragona),Casa del Águila en Cádiz,Casa de la Comida en Córdoba,Casa del Mosaico en Mérida,Casa del Águila en Cádiz,Casa del Técnico en Mérida,Casa del Lago en Mérida,Casa del Círculo en Córdoba,Casa del Horno en Mérida,Casa del Triclinio en Mérida,Casa del Círculo en Córdoba,Casa del Mosaico de Alcántara,Casa del Horno en Cádiz,Casa del Círculo en Tarragona,Casa del Mosaico de Tarragona,Casa del Horno en Tarragona,Casa del Círculo en Mérida,Casa del Mosaico de Córdoba
