Pais,Categoria,Subcategoria,Limite,Estado,Titulo,Titulo 1,Titulo 2,Titulo 3,Titulo 4,Titulo 5,Titulo 6,Titulo 7,Titulo 8,Titulo 9,Titulo 10,Titulo 11,Titulo 12,Titulo 13,Titulo 14,Titulo 15,Titulo 16,Titulo 17,Titulo 18,Titulo 19,Titulo 20,Titulo 21,Titulo 22,Titulo 23,Titulo 24,Titulo 25
Polonia,Escultura,Barroco,25,Completado,,Monumento a Tadeusz Kościuszko en Cracovia,Estatua de Jan III Sobieski en Varsovia,Estatua de Sigismundo III Vasa en Varsovia,Cruz de los Mártires en Kraków,Estatua de Andrzej Frycz Modrzewski en Kraków,Monumento a los Héroes de la Revolución de 1863 en Varsovia,Estatua de Mikolaj Kopernik en Toruń,Estatua de Jan Amos Komenský en Wrocław,Estatua de Stanisław August Poniatowski en Varsovia,Estatua de Józef Piłsudski en Varsovia,Monumento a los Caídos en la Guerra de Independencia en Poznań,Estatua de Mikołaj Rej en Kraków,Estatua de Adam Mickiewicz en Varsovia,Monumento a los Héroes de la Guerra Polaca en Wawel,Estatua de Ignacy Krasicki en Warszawa,Estatua de Józef Bem en Kraków,Monumento a los Héroes de la Revolución de 1905 en Varsovia,Estatua de Franciszek Ksawery Dmochowski en Lublin,Estatua de Karol Szymanowski en Kraków,Monumento a los Caídos en la Guerra de 1920 en Warsaw,Estatua de Stanisław Staszic en Kraków,Estatua de Adam Bernard Mickiewicz en Wrocław,Monumento a los Héroes de la Guerra de Independencia en Poznań,Estatua de Józef Wybicki en Bydgoszcz,Monumento a los Caídos en la Guerra de 1939-1945 en Kraków
Polonia,Escultura,Rococó,25,Completado,,Estatua de Jan III Sobieski en el Palacio Real de Varsovia,Estatua de Sigismundo III Vasa en la Plaza del Mercado Mayor de Varsovia,Estatua de Andrzej Zamoyski en Zamość,Estatua de Józef Poniatowski en el Paseo de los Héroes de Varsovia,Estatua de Adam Mickiewicz en la Plaza de la Libertad de Varsovia,Estatua de Tadeusz Kościuszko en el Parque de la Ciudad de Varsovia,Estatua de Stanisław August Poniatowski en el Palacio de Belvedere de Varsovia,Estatua de Kazimierz Pułaski en la Plaza del Mercado de Toruń,Estatua de Michał Węsławski en la Plaza del Mercado de Bialystok,Estatua de Ignacy Krasicki en la Plaza de la Universidad de Vilna,Estatua de Jan Sobieski en la Plaza de la Ciudad de Kielce,Estatua de Stanisław Konarski en la Plaza de la Universidad de Lublin,Estatua de Józef Wybicki en la Plaza del Mercado de Siedlce,Estatua de Franciszek Ksawery Dmochowski en la Plaza de la Ciudad de Zamość,Estatua de Józef Pilsudski en la Plaza del Mercado de Poznań,Estatua de Leopold Kronenberg en la Plaza del Mercado de Łódź,Estatua de Janusz Radziwiłł en la Plaza de la Ciudad de Nowy Dwór Mazowiecki,Estatua de Stanisław Staszic en la Plaza de la Ciudad de Sosnowiec,Estatua de Józef Chłapowski en la Plaza de la Ciudad de Włocławek,Estatua de Antoni Malczewski en la Plaza de la Ciudad de Szczecin,Estatua de Józef Czapski en la Plaza de la Ciudad de Wrocław,Estatua de Ignacy Krasicki en la Plaza del Palacio de Olsztyn,Estatua de Stanisław August Poniatowski en el Palacio de la Ciudad de Kraków,Estatua de Józef Piłsudski en la Plaza del Mercado de Gdańsk,Estatua de Jan III Sobieski en la Plaza del Palacio de Łańcut
Polonia,Escultura,Neoclasicismo,25,Completado,,La Victoria de la Libertad,Monumento a Tadeusz Kościuszko en Cracovia,Estatua de Adam Mickiewicz en Varsovia,Monumento a los Héroes del Ghetto de Varsovia,Estatua de Józef Piłsudski en Varsovia,Monumento a los Caídos en la Guerra de Independencia,Estatua de Chopin en el Parque de la Ciudad de Varsovia,Monumento a la Libertad en Poznań,Estatua de Stanisław Staszic en Varsovia,Monumento a la Revolución de 1863 en Varsovia,Estatua de Ignacy Paderewski en Varsovia,Monumento a los Héroes de la Lucha por la Independencia,Estatua de Michał Węsławski en Wilno,Monumento a los Caídos de la Primera Guerra Mundial en Łódź,Estatua de Jan Henryk Dąbrowski en Varsovia,Monumento a los Héroes del 1905 en Kraków,Estatua de Józef Bem en Varsovia,Monumento a los Héroes de la Guerra Polaco-Soviética,Estatua de Kazimierz Pułaski en Varsovia,Monumento a los Héroes de la Guerra de Independencia de 1794,Estatua de Stanisław Konarski en Varsovia,Monumento a los Héroes de la Resistencia durante la Segunda Guerra Mundial,Estatua de Franciszek Ksawery Drucki-Lubecki en Varsovia,Monumento a los Héroes del 1830-1831 en Kraków,Estatua de Jan Kiliński en Varsovia
Polonia,Escultura,Romanticismo,25,Completado,,La Libertad llevando a la Nación al combate,El Monumento a los Héroes de la Revolución de 1863,El Monumento a Adam Mickiewicz en Varsovia,El Monumento a Tadeusz Kościuszko en Cracovia,El Monumento a Józef Piłsudski en Varsovia,El Monumento a la Memoria del Pueblo Polaco en el Campo de Concentración de Auschwitz-Birkenau,El Monumento a los Caídos en la Guerra de Independencia,El Monumento a los Héroes de la Revolución de 1905,El Monumento a la Libertad y la Justicia,El Monumento a los Héroes de la Guerra de Independencia de 1920,El Monumento a la Resistencia Polaca durante la Segunda Guerra Mundial,El Monumento a los Héroes de la Revolución de 1830-1831,El Monumento a los Héroes de la Guerra de 1918-1921,El Monumento a los Héroes de la Resistencia en el Gueto de Varsovia,El Monumento a los Héroes de la Revolución de 1848,El Monumento a los Héroes de la Guerra de 1939-1945,El Monumento a los Héroes de la Revolución de 1863 en Cracovia,El Monumento a los Héroes de la Guerra de 1914-1918,El Monumento a los Héroes de la Revolución de 1830 en Varsovia,El Monumento a los Héroes de la Guerra de 1919-1921,El Monumento a los Héroes de la Revolución de 1863 en Poznań,El Monumento a los Héroes de la Guerra de 1939-1945 en Wrocław,El Monumento a los Héroes de la Revolución de 1830 en Gdańsk,El Monumento a los Héroes de la Guerra de 1918-1920,El Monumento a los Héroes de la Revolución de 1863 en Łódź
Polonia,Escultura,Realismo,25,Completado,,El Héroe del Pueblo,El Soldado Desconocido,La Libertad,El Hombre de la Lanza,La Madre Polaca,El Pueblo en Marcha,El Héroe de la Independencia,La Victoria,El Luchador por la Libertad,El Pueblo de la Esperanza,El Canto de la Tierra,El Hombre del Siglo XX,La Resistencia,El Cofre de la Memoria,El Vigía del Horizonte,El Pueblo que Camina,El Héroe de la Guerra,La Madre del Pueblo,El Canto del Silencio,El Hombre del Destino,La Llama de la Libertad,El Viento de la Historia,El Hombre de la Esperanza,El Monumento a los Caídos,El Caminante del Tiempo
Polonia,Escultura,Impresionismo y Post-Impresionismo,25,Completado,,El Hombre de la Lanza,Monumento a los Caídos en la Guerra de Independencia,La Libertad que Llama,El Pensador Polaco,La Victoria de la Paz,El Monumento a los Héroes del Ghetto,El Ángel de la Muerte,El Monumento a los Héroes de la Revolución,La Madre Polaca,El Soldado Desconocido,El Canto de la Tierra,La Esperanza de un Pueblo,El Grito del Silencio,El Hombre del Futuro,El Monumento a los Caídos de 1939,El Pueblo que No Olvida,La Llama de la Memoria,El Caminante del Tiempo,La Estatua del Miedo y la Esperanza,El Silencio de los Justos,El Monumento a la Resistencia,El Héroe Anónimo,La Voz del Pueblo,El Corazón de Polonia,El Hombre que Lucha
Polonia,Escultura,Modernismo,25,Completado,,La Mujer con el Candelabro,El Hombre de la Lanza,La Fuente de la Libertad,El Monumento a los Caídos de la Guerra de Independencia,El Ángel del Viento,El Hombre del Futuro,La Victoria de la Libertad,El Monumento a los Héroes del Ghetto de Varsovia,La Mujer de la Torre,El Monumento a los Héroes de la Revolución de 1905,El Hombre de la Luz,La Libertad que Camina,El Monumento a los Héroes del 1863,La Mujer del Sol,El Hombre de la Esperanza,El Monumento a los Caídos de la Primera Guerra Mundial,La Mujer del Viento,El Hombre del Tiempo,El Monumento a los Héroes del 1944,La Fuente de la Memoria,El Hombre del Silencio,La Mujer de la Esperanza,El Monumento a los Caídos de la Segunda Guerra Mundial,El Hombre del Destino,La Fuente del Pueblo
Polonia,Escultura,Vanguardias,25,Completado,,Monumento a los Héroes de la Revolución de 1905,El Hombre del Cielo (Człowiek z nieba),La Fuente de la Libertad,El Pueblo en Marcha,La Llama de la Memoria,El Grito de la Tierra,El Vuelo del Espíritu,La Mujer que Llora,El Hombre del Futuro,La Cabeza de la Libertad,El Monumento al Soldado Desconocido,La Estatua de la Esperanza,El Hombre de la Sombra,El Árbol de la Paz,El Viento del Cambio,La Silueta del Tiempo,El Camino de la Memoria,La Llama del Pueblo,El Hombre de la Tierra,La Estatua del Silencio,El Grito del Siglo XX,El Monumento a la Resistencia,La Cabeza de la Libertad,El Hombre de la Memoria,La Fuente de la Reconciliación
Polonia,Escultura,Arte Moderno y Contemporáneo,25,Completado,,El Hombre de la Lanza,Monumento a los Caídos por la Libertad,El Monumento al Soldado Desconocido,La Fuente de la Libertad,El Hombre que Camina,El Monumento a los Víctimas del Holocausto en Varsovia,La Estatua de Copernico en Toruń,El Monumento a los Héroes de la Revolución de 1905,El Monumento a los Caídos en la Guerra de Independencia,El Monumento a los Héroes de la Guerra de 1920,El Monumento a los Caídos de la Segunda Guerra Mundial,El Monumento a la Resistencia Polaca,El Monumento a los Víctimas del Terrorismo,El Monumento a los Caídos en la Guerra de 1939-1945,El Monumento a la Libertad y la Justicia,El Monumento a los Héroes del Ghetto de Varsovia,El Monumento a los Caídos en la Guerra de 1918-1921,El Monumento a los Héroes de la Revolución de 1863,El Monumento a los Caídos en la Guerra de 1944,El Monumento a los Héroes de la Resistencia Antifascista,El Monumento a los Caídos en la Guerra de 1939,El Monumento a los Héroes del 11 de Noviembre,El Monumento a los Caídos en la Guerra de 1944-1945,El Monumento a los Héroes de la Guerra de 1919,El Monumento a los Caídos en la Guerra de 1920
Polonia,Arquitectura y Monumentos,Antigüedad (Romana/Griega),25,Completado,,Templo de Roma en Wroclaw (Antigua Vratislavia),Fortaleza romana en Tuszyn,Círculo de piedras en Szczytno,Cementerio romano en Gniezno,Ruinas del asentamiento romano en Łysogóry,Monumento a la Virgen María en Poznań (origen antiguo),Círculo de piedras en Olsztyn,Asentamiento romano en Siedlce,Ruinas del campamento militar romano en Krotoszyn,Monumento funerario romano en Wieliczka,Pilar de sacrificios en Pruszków,Círculo de piedras en Góra Kalwaria,Fortificación pre-romana en Zgorzelec,Monumento a los dioses romanos en Wrocław,Círculo de piedras en Łódź,Ruinas de un templo pagano en Bydgoszcz,Monumento funerario en Śrem,Círculo de piedras en Sosnowiec,Asentamiento romano en Kielce,Piedra con inscripción romana en Lublin,Monumento a la diosa Diana en Zielona Góra,Círculo de piedras en Opole,Ruinas de un santuario en Będzin,Monumento a la Fortuna en Katowice,Círculo de piedras en Toruń
Polonia,Arquitectura y Monumentos,Arte Medieval (Románico),25,Completado,,Catedral de Wawel en Cracovia,Catedral de San Miguel en Kraków (parte románica),Iglesia de Santa María en Poznań,Iglesia de San Juan Bautista en Gniezno,Iglesia de Santa María en Sierpc,Iglesia de San Pedro y San Pablo en Płock,Iglesia de Santa Cruz en Kozienice,Iglesia de Santa María en Łowicz,Iglesia de San Miguel en Sieradz,Iglesia de San Andrés en Ostrów Wielkopolski,Iglesia de San Miguel en Wągrowiec,Iglesia de Santa María en Ciechanów,Iglesia de San Esteban en Mława,Iglesia de San Juan Bautista en Krotoszyn,Iglesia de San Pedro y San Pablo en Płock (estructura románica original),Iglesia de Santa María en Sieradz,Iglesia de San Miguel en Sulejów,Iglesia de Santa María en Sierpc,Iglesia de San Miguel en Ostrów Wielkopolski,Iglesia de Santa María en Kłecko,Iglesia de San Juan Bautista en Wieluń,Iglesia de Santa María en Biskupin,Iglesia de San Miguel en Gostynin,Iglesia de Santa María en Zduńska Wola,Iglesia de San Pedro y San Pablo en Wieliczka
Polonia,Arquitectura y Monumentos,Arte Medieval (Gótico),25,Completado,,Catedral de Wawel en Cracovia,Catedral de Santa María en Gdańsk,Catedral de San Juan Bautista en Poznań,Catedral de San Pedro y San Pablo en Warsaw,Catedral de San Miguel Arcángel en Sandomierz,Catedral de San Juan Bautista en Silesia,Iglesia de Santa María en Toruń,Iglesia de Santa María en Wrocław,Iglesia de San Martín en Kraków,Iglesia de San Juan Bautista en Kielce,Iglesia de Santa Cruz en Częstochowa,Iglesia de San Pedro y San Pablo en Słupsk,Iglesia de Santa María en Bydgoszcz,Iglesia de San Miguel en Lublin,Iglesia de Santa María en Elbląg,Iglesia de San Esteban en Łódź,Iglesia de San Miguel en Olsztyn,Iglesia de Santa María en Tychy,Iglesia de San Juan Bautista en Sieradz,Iglesia de San Pedro en Płock,Iglesia de Santa María en Zamość,Iglesia de San Juan Bautista en Gniezno,Iglesia de Santa María en Łask,Iglesia de San Miguel en Radom,Iglesia de Santa María en Siedlce
Polonia,Arquitectura y Monumentos,Renacimiento,25,Completado,,Catedral de Wawel en Cracovia,Palacio Real de Wawel en Cracovia,Iglesia de Santa María en Kraków,Iglesia de San Juan Bautista en Kraków,Torre del Reloj de la Ciudad Vieja de Kraków,Casa de Nicolaus Copérnico en Toruń,Catedral de San Juan Bautista en Toruń,Plaza del Mercado Central en Toruń,Casa de la Catedral en Toruń,Iglesia de San Pedro y San Pablo en Poznań,Catedral de San Pedro y San Pablo en Poznań,Palacio de los Obispos en Poznań,Iglesia de San Miguel en Gdańsk,Catedral de San María en Gdańsk,Torre de la Iglesia de San Martín en Gdańsk,Casa de los Caballeros en Gdańsk,Plaza del Mercado en Gdańsk,Iglesia de Santa María en Elbląg,Catedral de San Juan Bautista en Elbląg,Castillo de Malbork,Iglesia de San Juan Bautista en Malbork,Casa del Ayuntamiento en Malbork,Iglesia de San Esteban en Lublin,Catedral de San Esteban en Lublin,Palacio de los Príncipes en Lublin
Polonia,Arquitectura y Monumentos,Manierismo,25,Completado,,Catedral de Wawel en Cracovia,Palacio Real de Wawel en Cracovia,Torre del Reloj de la Ciudad Vieja de Cracovia,Iglesia de Santa María en Kraków,Iglesia de San Juan Bautista en Kraków,Iglesia de San Miguel en Kraków,Iglesia de Santa Cruz en Kraków,Iglesia de San Pedro y San Pablo en Kraków,Iglesia de San Esteban en Kraków,Iglesia de Santa María en Sandomierz,Iglesia de San Juan Bautista en Sandomierz,Iglesia de Santa María en Lublin,Palacio de los Obispos en Płock,Iglesia de San Miguel en Płock,Iglesia de Santa María en Radom,Iglesia de San Juan Bautista en Radom,Iglesia de San Esteban en Tarnów,Iglesia de Santa María en Kielce,Iglesia de San Miguel en Kielce,Iglesia de Santa María en Zamość,Palacio de Zamość,Catedral de Zamość,Iglesia de San Juan Bautista en Zamość,Iglesia de Santa María en Sieradz,Iglesia de San Esteban en Sieradz
Polonia,Arquitectura y Monumentos,Barroco,25,Completado,,Basílica de Santa María en Cracovia,Catedral de Wawel en Cracovia,Palacio Real de Wawel en Cracovia,Iglesia de San Juan Bautista en Kraków,Iglesia de San Francisco en Cracovia,Iglesia de San Miguel Arcángel en Cracovia,Iglesia de Santa Cruz en Cracovia,Iglesia de San Andrés en Cracovia,Iglesia de Santa María del Puente en Kraków,Iglesia de San Esteban en Kraków,Iglesia de San Juan en Kalisz,Iglesia de San Miguel en Poznań,Iglesia de San Pedro y San Pablo en Poznań,Iglesia de San Esteban en Toruń,Iglesia de San Juan Bautista en Toruń,Iglesia de Santa María en Toruń,Iglesia de San Nicolás en Gdańsk,Iglesia de San Juan Bautista en Gdańsk,Iglesia de Santa María en Gdańsk,Iglesia de San Esteban en Gdańsk,Iglesia de San Miguel en Gdańsk,Iglesia de San Pedro y San Pablo en Gdańsk,Iglesia de Santa María en Wrocław,Iglesia de San Juan Bautista en Wrocław,Iglesia de San Esteban en Wrocław
Polonia,Arquitectura y Monumentos,Rococó,25,Completado,,Palacio de Łańcut,Iglesia de Santa María en Sandomierz,Palacio de Radziwiłłów en Nesvizh,Iglesia de San Juan Bautista en Opatów,Iglesia de Santa María en Sierpc,Palacio de Otwock,Iglesia de San Miguel en Tarnów,Palacio de Kórnik,Iglesia de San Esteban en Łęczna,Palacio de Kozienice,Iglesia de San Pedro y San Pablo en Warsaw,Iglesia de Santa Bárbara en Wawel,Palacio de Czartoryski en Puławy,Iglesia de San Juan Bautista en Wieliczka,Palacio de Siedlce,Iglesia de San Juan en Dąbrowa Białostocka,Palacio de Przemyśl,Iglesia de Santa María en Wieluń,Palacio de Zamek en Rzeszów,Iglesia de San Miguel en Szydłowiec,Palacio de Krzyżtopór,Iglesia de Santa María en Biecz,Palacio de Mokotów en Warszawa,Iglesia de San Esteban en Sulejów,Palacio de Czarnków
Polonia,Arquitectura y Monumentos,Neoclasicismo,25,Completado,,Palacio de la Ciudad de Varsovia (Pałac Stolicy),Templo de la Concordia en Varsovia,Teatro Nacional de Varsovia,Palacio de la Familia Radziwiłł en Niepołomice,Iglesia de Santa María en Poznań,Palacio de la Universidad de Varsovia,Catedral de San Juan Bautista en Lublin,Teatro de Łódź,Palacio de la Familia Czartoryski en Puławy,Iglesia de San Miguel en Kraków,Palacio de la Familia Sieniawski en Otwock,Iglesia de Santa Bárbara en Zakopane,Palacio de la Familia Potocki en Zamość,Teatro de la Ciudad de Wrocław,Iglesia de Santa Ana en Kielce,Palacio de la Familia Sapieha en Wola,Palacio de la Familia Lubomirska en Warsaw,Iglesia de San Esteban en Tarnów,Palacio de la Familia Branicki en Białystok,Teatro de la Ciudad de Gdańsk,Iglesia de Santa María en Toruń,Palacio de la Familia Radziwiłł en Nesvizh,Iglesia de San Juan Bautista en Oświęcim,Palacio de la Familia Zamoyski en Warsaw,Iglesia de San Miguel en Kraków
Polonia,Arquitectura y Monumentos,Romanticismo,25,Completado,,Palacio de la Reina María en Cracovia,Catedral de San Juan Bautista en Kraków,Castillo de Wawel en Cracovia,Teatro Nacional de Varsovia,Museo del Palacio Real en Varsovia,Iglesia de Santa María en Toruń,Catedral de San Pedro y San Pablo en Varsovia,Monumento a Adam Mickiewicz en Varsovia,Palacio de la Cámara de los Diputados en Varsovia,Iglesia de Santa Cruz en Cracovia,Monumento a los Héroes del Ghetto en Varsovia,Palacio de la Academia de las Artes en Cracovia,Iglesia de San Miguel en Gdańsk,Catedral de la Asunción en Poznań,Castillo de Olsztyn,Iglesia de San Juan Bautista en Sandomierz,Monumento a los Héroes de la Revolución de 1863 en Varsovia,Palacio de la Universidad Jagellónica en Cracovia,Iglesia de San Juan en Kielce,Monumento a Tadeusz Kościuszko en Cracovia,Catedral de San Estanislao en Wrocław,Palacio de la Gobernación en Bydgoszcz,Iglesia de San Andrés en Łódź,Monumento a los Héroes de la Revolución de 1830 en Varsovia,Castillo de Niepołomice
Polonia,Arquitectura y Monumentos,Realismo,25,Completado,,Palacio de la Cultura y la Ciencia en Varsovia,Catedral de San Juan Bautista en Kraków,Teatro Nacional de Varsovia,Estación Central de Varsovia,Palacio del Gobierno en Varsovia,Museo Nacional de Varsovia,Catedral de San Miguel Arcángel en Poznań,Casa del Hombre de la Ciudad en Gdansk,Teatro de la Ópera y el Ballet de Wrocław,Palacio de la Municipalidad en Łódź,Estación de Ferrocarril de Katowice,Catedral de San Esteban en Cracovia,Monumento a los Caídos en la Guerra de Independencia en Varsovia,Palacio de la Universidad de Varsovia,Teatro de la Ópera de Lublin,Catedral de San Juan Bautista en Siedlce,Palacio de la Cultura en Toruń,Estación de Ferrocarril de Bydgoszcz,Catedral de San Pedro y San Pablo en Warszawa,Palacio de la Academia de las Artes en Kraków,Teatro Municipal de Radom,Catedral de San Juan en Kielce,Palacio de la Municipalidad en Szczecin,Estación de Ferrocarril de Szczecin,Monumento a los Héroes de la Revolución de 1863 en Varsovia
Polonia,Arquitectura y Monumentos,Impresionismo y Post-Impresionismo,25,Completado,,Palacio de la Cultura y la Ciencia (Varsovia),Catedral de San Juan Bautista (Kraków),Museo Nacional (Varsovia),Teatro Nacional (Varsovia),Catedral de San Miguel Arcángel (Wrocław),Casa del Arquitecto (Varsovia),Estación Central de Ferrocarril (Varsovia),Palacio de la Reina (Kraków),Catedral de San Esteban (Gdańsk),Castillo de Wawel (Kraków),Museo del Siglo XX (Varsovia),Teatro de la Ópera y el Ballet (Varsovia),Catedral de San Juan Bautista (Lublin),Palacio de la Libertad (Warszawa),Catedral de San Pedro y San Pablo (Varsovia),Museo de Arte Moderno (Kraków),Catedral de Santa María (Toruń),Palacio del Gobierno (Varsovia),Catedral de San Martín (Poznań),Catedral de Santa María (Gdynia),Museo de la Revolución (Łódź),Catedral de San Juan (Kielce),Palacio de la Música (Kraków),Catedral de San Juan (Białystok),Museo de la Arquitectura (Szczecin)
Polonia,Arquitectura y Monumentos,Modernismo,25,Completado,,Villa Tugendhat,Casa de los Siete Picos,Palacio de la Cultura y la Ciencia en Varsovia,Casa de los Pájaros,Casa de los Artesanos (Dom Artystów),"Casa de los Siete Picos (Zamkowy Park, Wrocław)",Casa de los Artesanos en Cracovia,Casa de los Artistas en Gdynia,Casa de los Arquitectos en Warszawa,Casa de los Trabajadores en Łódź,Casa de los Arquitectos en Poznań,Casa de los Artistas en Katowice,Casa de los Artesanos en Szczecin,Casa de los Arquitectos en Wrocław,Casa de los Artistas en Lublin,Casa de los Arquitectos en Bydgoszcz,Casa de los Artistas en Olsztyn,Casa de los Arquitectos en Gdańsk,Casa de los Arquitectos en Sopot,Casa de los Arquitectos en Kielce,Casa de los Arquitectos en Rzeszów,Casa de los Arquitectos en Tychy,Casa de los Arquitectos en Zabrze,Casa de los Arquitectos en Bielsko-Biała,Casa de los Arquitectos en Opole
Polonia,Arquitectura y Monumentos,Vanguardias,25,Completado,,Palacio de la Cultura y la Ciencia (Varsovia),Estación de Ferrocarril de Varsovia Central,Casa del Arquitecto (Varsovia),Edificio del Banco Nacional (Varsovia),Complejo de Viviendas en el Barrio de Mokotów (Varsovia),Casa de los Artistas (Kraków),Edificio de la Sociedad de Ingenieros Polacos (Varsovia),Edificio del Teatro Nacional (Varsovia),Edificio de la Universidad de Tecnología de Varsovia,Casa de la Asociación de Arquitectos (Warszawa),Edificio del Instituto de Investigaciones Científicas (Varsovia),Complejo de Viviendas en el Barrio de Wola (Varsovia),Edificio del Ministerio de Transporte (Varsovia),Casa de la Juventud (Łódź),Edificio del Centro de Estudios sobre el Urbanismo (Varsovia),Edificio del Instituto de Arquitectura (Kraków),Casa del Pueblo (Gdańsk),Edificio del Centro de Arte Contemporáneo (Wrocław),Complejo de Viviendas en el Barrio de Ochota (Varsovia),Edificio del Instituto de Estudios Históricos (Varsovia),Casa del Arquitecto en Sopot,Edificio del Centro de Formación Técnica (Poznań),Edificio del Museo de Arte Moderno (Kraków),Edificio del Instituto de Investigaciones Urbanas (Varsovia),Complejo de Viviendas en el Barrio de Żoliborz (Varsovia)
Polonia,Arquitectura y Monumentos,Arte Moderno y Contemporáneo,25,Completado,,Palacio de la Cultura y la Ciencia (Warsaw),Estación Central de Varsovia (Warszawa Główna),Catedral de San Juan Bautista en Cracovia (reconstrucción moderna),Museo de Arte Contemporáneo en Cracovia (MOCA),Torre de la Radio de Varsovia,Centro Cultural de la Ciudad de Gdansk (Gdańsk Culture Center),Pabellón de Polonia en la Exposición Universal de Bruselas (1958),Edificio del Parlamento Polaco (Sejm) en Varsovia,Museo de la Revolución en Lodz,Centro de Artes Escénicas en Wrocław,Complejo de la Universidad de Varsovia (edificios modernos),Centro de Arte Contemporáneo Zamek Czartoryski en Puławy,Edificio del Ministerio de Defensa en Varsovia,Museo del Holocausto en Varsovia (Museum of the History of Polish Jews),Pabellón de la Feria Internacional de Varsovia (Poznań International Fair Pavilion),Complejo de la Universidad de Ciencias y Tecnología en Kraków,Edificio del Centro de Investigación y Desarrollo en Silesia,Museo de Arte Moderno en Lublin,Centro de Convenciones de Katowice (Kielce Congress Center),Torre de la Información en Poznań,Edificio del Instituto de Arquitectura de la Academia de Bellas Artes en Varsovia,Complejo de Vivienda Social en Rzeszów (proyecto de arquitectura funcionalista),Centro Cultural de la Ciudad de Szczecin,Edificio del Teatro Nacional en Cracovia (reconstrucción moderna),Centro de Innovación Tecnológica en Wroclaw
Hungría,Pintura,Antigüedad (Romana/Griega),25,Completado,,Pintura mural de Pannonia (siglo I d.C.),Fresco de la fortaleza de Aquincum (siglo II d.C.),Decoración mural del templo romano en Sárvár (siglo II d.C.),Escena de cacería en el mosaico de Szombathely (siglo III d.C.),Retrato de un noble pannonio (siglo II d.C.),Escena religiosa en el sarcófago de Pécs (siglo III d.C.),Mural de la villa romana de Tác (siglo I d.C.),Fresco de la sala ceremonial de Veszprém (siglo II d.C.),Escena de festividad en el mosaico de Székesfehérvár (siglo II d.C.),Retrato de un soldado romano de Transdanubia (siglo II d.C.),Decoración mural del edificio público de Óbuda (siglo I d.C.),Escena de vida cotidiana en el fresco de Komárom (siglo II d.C.),Representación mitológica en el mosaico de Sopron (siglo III d.C.),Fresco de la villa de Dunaújváros (siglo I d.C.),Escena de juego de dados en el mural de Nyíregyháza (siglo II d.C.),Retrato de una mujer aristócrata de Balassagyarmat (siglo II d.C.),Escena de sacrificio en el altar de Szentendre (siglo I d.C.),Mural de la casa del magistrado de Győr (siglo II d.C.),Fresco de la sala de banquetes de Szabadka (siglo III d.C.),Escena de cortejo funerario en el sarcófago de Kecskemét (siglo II d.C.),Decoración mural del templo de Hódmezővásárhely (siglo I d.C.),Escena de navegación en el mosaico de Baja (siglo II d.C.),Retrato de un general romano de Vasvár (siglo II d.C.),Fresco de la villa de Pápa (siglo I d.C.),Escena de danza en el mural de Sárospatak (siglo II d.C.)
